opendata_id,city,postcode,latitude,longitude,ihk_branch_id,nace_id,branch_top_level_id,employees_range,ihk_branch_desc,nace_desc,branch_top_level_desc,business_age,business_type,Bezirk,planungsraum_id,Planungsraum,Bezirksregion,Prognoseraum,Ortsteil1003485174,Berlin,14169,52.451133255,13.261917015,59110,5911,59,1 - 3 Beschäftigte,"H. v. Filmen, Videofilmen u. Fernsehprogrammen","H. v. Filmen, Videofilmen u. Fernsehprogrammen","Herstellung, Verleih u. Vertrieb v. Filmen u. Fernsehprogram",38,Kleingewerbetreibender,Steglitz-Zehlendorf,06400840,Fischtal,Zehlendorf Nord,Zehlendorf Nord/Wannsee,Zehlendorf94040047668,Berlin,10967,52.4895591,13.424526898,62020,6202,62,1 - 3 Beschäftigte,Erbringung v. Beratungsleistungen auf dem Gebiet der Informa,Erbringung v. Beratungsleistungen auf dem Gebiet der Informa,Erbringung v. Dienstleistungen der Informationstechnologie,8,Kleingewerbetreibender,Neukölln,08100311,Reuterplatz,Reuterstraße,Neukölln,Neukölln7067556702,Berlin,10969,52.502553906,13.414164189,18200,1820,18,0 Beschäftigte,"Vervielfältigung v. bespielten Ton-, Bild- u. Datenträgern","Vervielfältigung v. bespielten Ton-, Bild- u. Datenträgern",H. v. Druckerzeugnissen; Vervielfältigung v. bespielten Ton-,27,im Handelsregister eingetragen,Friedrichshain-Kreuzberg,02100104,Moritzplatz,Südliche  Friedrichstadt,Kreuzberg Nord,Kreuzberg7720306812,Berlin,14057,52.504928721,13.298762236,4642,4642,46,0 Beschäftigte,GH m. Bekleidung u. Schuhen,GH m. Bekleidung u. Schuhen,Großhandel (ohne Handel mit Kraftfahrzeugen u. Krafträdern),13,im Handelsregister eingetragen,Charlottenburg-Wilmersdorf,04300416,Amtsgerichtsplatz,Schloss Charlottenburg,Charlottenburg Zentrum,Charlottenburg83254061016,Berlin,10555,52.515758305,13.336694198,56103,5610,56,0 Beschäftigte,Imbissstuben u.ä.,"Restaurants, Gaststätten, Imbissstuben, Cafés, Eissalons u.",Gastronomie,27,im Handelsregister eingetragen,Mitte,01200629,Hansaviertel,Moabit Ost,Moabit,Hansaviertel83494061976,Berlin,14057,52.503212361,13.293055461,7490009,7490,74,1 - 3 Beschäftigte,Sonstige Vermögensberatung,"Sonstige freiberufliche, wissenschaftliche u. technische Tät","Sonstige freiberufliche, wissenschaftliche u. technische Tät",36,Kleingewerbetreibender,Charlottenburg-Wilmersdorf,04300416,Amtsgerichtsplatz,Schloss Charlottenburg,Charlottenburg Zentrum,Charlottenburg93479061916,Berlin,12627,52.537418942,13.605587726,66,66,66,1 - 3 Beschäftigte,Mit Finanz- u. Versicherungsdienstleistungen verbundene Täti,Mit Finanz- u. Versicherungsdienstleistungen verbundene Täti,Mit Finanz- u. Versicherungsdienstleistungen verbundene Täti,26,Kleingewerbetreibender,Marzahn-Hellersdorf,10200421,Helle Mitte,Hellersdorf Nord,Hellersdorf,Hellersdorf102325561302,Berlin,12107,52.440748892,13.388942967,62090,6209,62,0 Beschäftigte,Erbringung v. sonstigen Dienstleistungen der Informationstec,Erbringung v. sonstigen Dienstleistungen der Informationstec,Erbringung v. Dienstleistungen der Informationstechnologie,26,im Handelsregister eingetragen,Tempelhof-Schöneberg,07501031,Eisenacher Straße,Mariendorf Nord,Mariendorf,Mariendorf9865856634,Berlin,13405,52.564598706,13.320584734,463702,4637,46,1 - 3 Beschäftigte,GH m. Gewürzen,"GH m. Kaffee, Tee, Kakao u. Gewürzen",Großhandel (ohne Handel mit Kraftfahrzeugen u. Krafträdern),26,Kleingewerbetreibender,Reinickendorf,12200411,Schumacher-Quartier,West 1 - Tegel-Süd/Flughafensee,Tegel,Reinickendorf100285061140,Berlin,10787,52.504036768,13.342992113,68311,6831,68,0 Beschäftigte,"Vermittlung v. Wohngrundstücken, Wohngebäuden u. Wohnungen f","Vermittlung v. Grundstücken, Gebäuden u. Wohnungen f. Dritte",Grundstücks- u. Wohnungswesen,26,im Handelsregister eingetragen,Tempelhof-Schöneberg,07100101,Wittenbergplatz,Schöneberg Nordwest,Schöneberg Nord,Schöneberg98849561398,Berlin,12109,52.452017817,13.384289529,662200,6622,66,0 Beschäftigte,Versicherungsvertreter,Tätigkeit v. Versicherungsmaklerinnen u. -maklern,Mit Finanz- u. Versicherungsdienstleistungen verbundene Täti,26,im Handelsregister eingetragen,Tempelhof-Schöneberg,07501030,Machonstraße,Mariendorf Nord,Mariendorf,Mariendorf11771256850,Berlin,12685,52.540381673,13.559389431,562900,5629,56,0 Beschäftigte,Kantinen,Erbringung sonstiger Verpflegungsdienstleistungen,Gastronomie,26,im Handelsregister eingetragen,Marzahn-Hellersdorf,10100314,Auersbergstraße,Marzahn Süd,Marzahn,Marzahn113915561662,Berlin,12107,52.43998314,13.384601062,47789,4778,47,0 Beschäftigte,Sonstiger Einzelhandel a. n. g. (in Verkaufsräumen),Sonstiger Einzelhandel in Verkaufsräumen (ohne Antiquitäten,Einzelhandel (ohne Handel mit Kraftfahrzeugen),26,im Handelsregister eingetragen,Tempelhof-Schöneberg,07501030,Machonstraße,Mariendorf Nord,Mariendorf,Mariendorf12556106244,Berlin,12557,52.429960009,13.596123796,463600,4636,46,0 Beschäftigte,GH m. Süßwaren,"GH m. Zucker, Süßwaren u. Backwaren",Großhandel (ohne Handel mit Kraftfahrzeugen u. Krafträdern),26,im Handelsregister eingetragen,Treptow-Köpenick,09401329,Kietzer Feld/Nachtheide,Köpenick Süd,Treptow-Köpenick 4,Köpenick140354061416,Berlin,13439,52.606510048,13.362600288,69204,6920,69,0 Beschäftigte,Buchführung (ohne Datenverarbeitungsdienste),Wirtschaftsprüfung u. Steuerberatung; Buchführung,"Rechts- u. Steuerberatung, Wirtschaftsprüfung",25,im Handelsregister eingetragen,Reinickendorf,12601134,Märkisches Zentrum,MV Nord,Märkisches Viertel,Märkisches Viertel13561606464,Berlin,14165,52.421625216,13.26233652,68321,6832,68,0 Beschäftigte,"Verwaltung v. Wohngrundstücken, Wohngebäuden u. Wohnungen f.","Verwaltung v. Grundstücken, Gebäuden u. Wohnungen f. Dritte",Grundstücks- u. Wohnungswesen,25,im Handelsregister eingetragen,Steglitz-Zehlendorf,06300528,Teltower Damm,Teltower Damm,Zehlendorf Süd/Lichterfelde West,Zehlendorf135404561618,Berlin,13125,52.620464959,13.479324458,479991,4799,47,0 Beschäftigte,Versandhandelsvertretung,"Sonstiger Einzelhandel nicht in Verkaufsräumen, an Verkaufss",Einzelhandel (ohne Handel mit Kraftfahrzeugen),25,im Handelsregister eingetragen,NULL,,NULL,NULL,NULL,Karow135410561642,Berlin,13055,52.546395274,13.502217685,77320,7732,77,1 - 3 Beschäftigte,Vermietung v. Baumaschinen u. -geräten,Vermietung v. Baumaschinen u. -geräten,Vermietung v. beweglichen Sachen,25,Kleingewerbetreibender,Lichtenberg,11200411,Hauptstraße,Alt-Hohenschönhausen Nord,Hohenschönhausen Süd,Alt-Hohenschönhausen13766656666,Berlin,13465,52.629832962,13.276675091,869093,8690,86,0 Beschäftigte,"Fußpflege, medizinisch / Podologe",Gesundheitswesen a. n. g.,Gesundheitswesen,25,im Handelsregister eingetragen,Reinickendorf,12400720,Frohnau West,Nord 1 - Frohnau/Hermsdorf,Grüner Norden,Frohnau13719956798,Berlin,12587,52.456427732,13.634207733,68311,6831,68,1 - 3 Beschäftigte,"Vermittlung v. Wohngrundstücken, Wohngebäuden u. Wohnungen f","Vermittlung v. Grundstücken, Gebäuden u. Wohnungen f. Dritte",Grundstücks- u. Wohnungswesen,25,Kleingewerbetreibender,Treptow-Köpenick,09501737,Alt-Friedrichshagen,Friedrichshagen,Treptow-Köpenick 5,Friedrichshagen13720556822,Berlin,10623,52.50664977,13.325692098,68321,6832,68,1 - 3 Beschäftigte,"Verwaltung v. Wohngrundstücken, Wohngebäuden u. Wohnungen f.","Verwaltung v. Grundstücken, Gebäuden u. Wohnungen f. Dritte",Grundstücks- u. Wohnungswesen,25,Kleingewerbetreibender,Charlottenburg-Wilmersdorf,04300624,Savignyplatz,Otto-Suhr-Allee/Kantstraße,Charlottenburg Zentrum,Charlottenburg13121156846,Berlin,13086,52.551708527,13.459038447,88990,8899,88,0 Beschäftigte,Sonstiges Sozialwesen a. n. g.,Sonstiges Sozialwesen a. n. g.,Sozialwesen (ohne Heime),26,Kleingewerbetreibender,Pankow,03500933,Weißer See,Weißensee,Südliches Weißensee,Weißensee144868561474,Berlin,10719,52.499382391,13.328542524,412010,4120,41,10 - 19 Beschäftigte,"Altbausanierung, Renovierung u. Umbauten",Bau v. Gebäuden,Hochbau,25,Kleingewerbetreibender,Charlottenburg-Wilmersdorf,04501045,Schaperstraße,Lietzenburger Straße,Wilmersdorf Zentrum,Wilmersdorf16521806872,Berlin,14193,52.484185793,13.274727572,855993,8559,85,7 - 9 Beschäftigte,Durchführung v. Seminaren / Workshops,Sonstiger Unterricht a. n. g.,Erziehung u. Unterricht,24,Kleingewerbetreibender,Charlottenburg-Wilmersdorf,04400728,Hagenplatz,Grunewald,Wilmersdorf Süd,Grunewald158987561950,Berlin,14199,52.48102523,13.288484377,68,68,68,1 - 3 Beschäftigte,Grundstücks- u. Wohnungswesen,Grundstücks- u. Wohnungswesen,Grundstücks- u. Wohnungswesen,25,Kleingewerbetreibender,Charlottenburg-Wilmersdorf,04400830,Forckenbeckstraße,Schmargendorf,Wilmersdorf Süd,Schmargendorf15719006760,Berlin,12169,52.452614168,13.35211026,662200,6622,66,1 - 3 Beschäftigte,Versicherungsvertreter,Tätigkeit v. Versicherungsmaklerinnen u. -maklern,Mit Finanz- u. Versicherungsdienstleistungen verbundene Täti,25,im Handelsregister eingetragen,Steglitz-Zehlendorf,06100204,Munsterdamm,Albrechtstraße,Steglitz,Steglitz15663756550,Berlin,12047,52.486724648,13.427831398,79110,7911,79,0 Beschäftigte,Reisebüros,Reisebüros,"Reisebüros, Reiseveranstalter u. Erbringung sonstiger Reserv",26,Kleingewerbetreibender,Neukölln,08100314,Donaustraße,Reuterstraße,Neukölln,Neukölln167781061124,Berlin,12627,52.537705312,13.605035916,79110,7911,79,1 - 3 Beschäftigte,Reisebüros,Reisebüros,"Reisebüros, Reiseveranstalter u. Erbringung sonstiger Reserv",24,Kleingewerbetreibender,Marzahn-Hellersdorf,10200421,Helle Mitte,Hellersdorf Nord,Hellersdorf,Hellersdorf168487561950,Berlin,12683,52.494518149,13.563132002,92001,9200,92,0 Beschäftigte,Spielhallen u. Betrieb v. Spielautomaten,"Spiel-, Wett- u. Lotteriewesen","Spiel-, Wett- u. Lotteriewesen",20,im Handelsregister eingetragen,Marzahn-Hellersdorf,10300734,Biesdorf Süd,Biesdorf,Biesdorf,Biesdorf166967561870,Berlin,12157,52.467638359,13.342389926,56101,5610,56,1 - 3 Beschäftigte,Restaurants mit herkömmlicher Bedienung,"Restaurants, Gaststätten, Imbissstuben, Cafés, Eissalons u.",Gastronomie,25,im Handelsregister eingetragen,Tempelhof-Schöneberg,07300619,Grazer Platz,Friedenau Ost,Friedenau,Schöneberg170349061396,Berlin,12107,52.414904497,13.401307886,10130,1013,10,1 - 3 Beschäftigte,Fleischverarbeitung,Fleischverarbeitung,H. v. Nahrungs- u. Futtermitteln,24,Kleingewerbetreibender,Neukölln,08200831,Buckow West,Buckow,Britz/Buckow,Buckow17009756390,Berlin,12555,52.442907728,13.582245291,47191,4719,47,0 Beschäftigte,EH m. Waren verschiedener Art (ohne Nahrungsmittel),Sonstiger Einzelhandel m. Waren verschiedener Art,Einzelhandel (ohne Handel mit Kraftfahrzeugen),24,im Handelsregister eingetragen,Treptow-Köpenick,09401534,Altstadt Köpenick,Altstadt Köpenick,Treptow-Köpenick 4,Köpenick16965656626,Berlin,14195,52.465700274,13.270961442,55901,5590,55,0 Beschäftigte,Privatquartiere,Sonstige Beherbergungsstätten,Beherbergung,22,im Handelsregister eingetragen,Steglitz-Zehlendorf,06400842,Hüttenweg,Zehlendorf Nord,Zehlendorf Nord/Wannsee,Dahlem1655235694,Berlin,13505,52.58616878,13.232557738,56301,5630,56,1 - 3 Beschäftigte,Schankwirtschaften,Ausschank v. Getränken,Gastronomie,25,im Handelsregister eingetragen,Reinickendorf,12400616,Konradshöhe/Tegelort,West 2 - Heiligensee/Konradshöhe,Grüner Norden,Konradshöhe181916061664,Berlin,10967,52.489217116,13.408710539,731102,7311,73,0 Beschäftigte,Gebrauchsgraphik,Werbeagenturen,Werbung u. Marktforschung,24,im Handelsregister eingetragen,Friedrichshain-Kreuzberg,02200212,Graefekiez Süd,Tempelhofer Vorstadt,Kreuzberg Süd,Kreuzberg174991061964,Berlin,10707,52.500824408,13.319568556,13300,1330,13,0 Beschäftigte,Veredlung v. Textilien u. Bekleidung,Veredlung v. Textilien u. Bekleidung,H. v. Textilien,24,im Handelsregister eingetragen,Charlottenburg-Wilmersdorf,04501041,George-Grosz-Platz,Lietzenburger Straße,Wilmersdorf Zentrum,Charlottenburg18657306292,Berlin,10318,52.482900003,13.524149198,451101,4511,45,1 - 3 Beschäftigte,EH m. neuen u. gebrauchten Kraftwagen: Personenkraftwagen ei,"Handel m. Kraftwagen mit einem Gesamtgewicht v. 3,5 t oder w",Handel mit Kraftfahrzeugen; Instandhaltung u. Reparatur v. K,24,Kleingewerbetreibender,Lichtenberg,11501339,Karlshorst West,Karlshorst,Lichtenberg Süd,Karlshorst204380061520,Berlin,12627,52.536298016,13.601861998,86909,8690,86,1 - 3 Beschäftigte,Sonstige selbstständige Tätigkeiten im Gesundheitswesen,Gesundheitswesen a. n. g.,Gesundheitswesen,23,Kleingewerbetreibender,Marzahn-Hellersdorf,10200421,Helle Mitte,Hellersdorf Nord,Hellersdorf,Hellersdorf203958061832,Berlin,13503,52.614796118,13.225939067,823001,8230,82,0 Beschäftigte,Messebau,"Messe-, Ausstellungs- u. Kongressveranstalter",Erbringung v. wirtschaftlichen Dienstleistungen f. Unternehm,23,im Handelsregister eingetragen,Reinickendorf,12400617,Alt-Heiligensee,West 2 - Heiligensee/Konradshöhe,Grüner Norden,Heiligensee19960456418,Berlin,12309,52.402359437,13.420293589,70101,7010,70,1 - 3 Beschäftigte,Managementtätigkeiten v. Holdinggesellschaften,Verwaltung u. Führung v. Unternehmen u. Betrieben,Verwaltung u. Führung v. Unternehmen u. Betrieben; Unternehm,23,Kleingewerbetreibender,Tempelhof-Schöneberg,07601443,Töpchiner Weg,Lichtenrade Nord,Marienfelde / Lichtenrade,Lichtenrade199482561930,Berlin,12681,52.536857985,13.527814259,692030,6920,69,0 Beschäftigte,Lohnsteuerhilfe,Wirtschaftsprüfung u. Steuerberatung; Buchführung,"Rechts- u. Steuerberatung, Wirtschaftsprüfung",23,im Handelsregister eingetragen,Marzahn-Hellersdorf,10100311,Marzahner Chaussee,Marzahn Süd,Marzahn,Marzahn21755206208,Berlin,10623,52.505028834,13.32758957,7490010,7490,74,1 - 3 Beschäftigte,Vermögensverwaltung,"Sonstige freiberufliche, wissenschaftliche u. technische Tät","Sonstige freiberufliche, wissenschaftliche u. technische Tät",32,Kleingewerbetreibender,Charlottenburg-Wilmersdorf,04300622,Ernst-Reuter-Platz,Otto-Suhr-Allee/Kantstraße,Charlottenburg Zentrum,Charlottenburg215934561738,Berlin,10117,52.51044364,13.395674759,47730,4773,47,1 - 3 Beschäftigte,Apotheken,Apotheken,Einzelhandel (ohne Handel mit Kraftfahrzeugen),23,Kleingewerbetreibender,Mitte,01100207,Leipziger Straße,Regierungsviertel,Zentrum,Mitte216763561054,Berlin,10707,52.501043547,13.313361079,701090,7010,70,1 - 3 Beschäftigte,Komplementärgesellschaften,Verwaltung u. Führung v. Unternehmen u. Betrieben,Verwaltung u. Führung v. Unternehmen u. Betrieben; Unternehm,23,Kleingewerbetreibender,Charlottenburg-Wilmersdorf,04501041,George-Grosz-Platz,Lietzenburger Straße,Wilmersdorf Zentrum,Charlottenburg206821561286,Berlin,14089,52.44781532,13.128523033,620113,6201,62,0 Beschäftigte,Gestaltung v. Internet-Angeboten / Homepagedesign /Webdesign,Programmierungstätigkeiten,Erbringung v. Dienstleistungen der Informationstechnologie,23,im Handelsregister eingetragen,Spandau,05400945,Kafkastraße,Gatow/Kladow,Gatow / Kladow,Kladow20969806792,Berlin,13088,52.563318011,13.477543644,662200,6622,66,0 Beschäftigte,Versicherungsvertreter,Tätigkeit v. Versicherungsmaklerinnen u. -maklern,Mit Finanz- u. Versicherungsdienstleistungen verbundene Täti,23,im Handelsregister eingetragen,Pankow,03501038,Hansastraße,Weißensee Ost,Südliches Weißensee,Weißensee228304061216,Berlin,10629,52.503399272,13.308510982,731108,7311,73,0 Beschäftigte,"Promotion, Propagandisten",Werbeagenturen,Werbung u. Marktforschung,23,im Handelsregister eingetragen,Charlottenburg-Wilmersdorf,04501040,Hindemithplatz,Lietzenburger Straße,Wilmersdorf Zentrum,Charlottenburg235923561694,Berlin,10117,52.511163116,13.391491017,69203,6920,69,1 - 3 Beschäftigte,"Praxen v. Steuerbevollmächtigten, Steuerberaterinnen u. -ber",Wirtschaftsprüfung u. Steuerberatung; Buchführung,"Rechts- u. Steuerberatung, Wirtschaftsprüfung",22,Kleingewerbetreibender,Mitte,01100207,Leipziger Straße,Regierungsviertel,Zentrum,Mitte229865561462,Berlin,13467,52.6072214,13.295541532,59201,5920,59,1 - 3 Beschäftigte,Tonstudios u. H. v. Hörfunkbeiträgen,Tonstudios; H. v. Hörfunkbeiträgen; Verlegen v. bespielten T,"Herstellung, Verleih u. Vertrieb v. Filmen u. Fernsehprogram",22,Kleingewerbetreibender,Reinickendorf,12400722,Hermsdorf West,Nord 1 - Frohnau/Hermsdorf,Grüner Norden,Hermsdorf23210506420,Berlin,13353,52.548040315,13.353047972,64200,6420,64,0 Beschäftigte,Beteiligungsgesellschaften,Beteiligungsgesellschaften,Erbringung v. Finanzdienstleistungen,22,Kleingewerbetreibender,Mitte,01400942,Westliche Müllerstraße,Parkviertel,Wedding,Wedding232395561582,Berlin,13583,52.548909794,13.174493125,96022,9602,96,0 Beschäftigte,Kosmetiksalons,Frisör- u. Kosmetiksalons,Erbringung v. sonstigen überwiegend persönlichen Dienstleist,23,im Handelsregister eingetragen,Spandau,05100211,An der Kappe,Falkenhagener Feld,Spandau Mitte / Nord,Falkenhagener Feld235784061136,Berlin,10245,52.51033239,13.462633903,6810,6810,68,1 - 3 Beschäftigte,"Kauf u. Verkauf v. eigenen Grundstücken, Gebäuden u. Wohnung","Kauf u. Verkauf v. eigenen Grundstücken, Gebäuden u. Wohnung",Grundstücks- u. Wohnungswesen,23,Kleingewerbetreibender,Friedrichshain-Kreuzberg,02500833,Boxhagener Platz,Frankfurter Allee Süd FK,Friedrichshain Ost,Friedrichshain22809806392,Berlin,14199,52.484296132,13.301613693,476420,4764,47,0 Beschäftigte,"EH m. Sport- u. Campingartikeln (ohne Campingmöbel), Sportge","EH m. Fahrrädern, Sport- u. Campingartikeln",Einzelhandel (ohne Handel mit Kraftfahrzeugen),22,im Handelsregister eingetragen,Charlottenburg-Wilmersdorf,04400830,Forckenbeckstraße,Schmargendorf,Wilmersdorf Süd,Schmargendorf2315065626,Berlin,10825,52.479308643,13.337194506,562900,5629,56,0 Beschäftigte,Kantinen,Erbringung sonstiger Verpflegungsdienstleistungen,Gastronomie,22,im Handelsregister eingetragen,Tempelhof-Schöneberg,07200308,Volkspark (Rudolph-Wilde-Park),Schöneberg Südwest,Schöneberg Süd,Schöneberg24853056122,Berlin,12685,52.543881801,13.568512001,476420,4764,47,0 Beschäftigte,"EH m. Sport- u. Campingartikeln (ohne Campingmöbel), Sportge","EH m. Fahrrädern, Sport- u. Campingartikeln",Einzelhandel (ohne Handel mit Kraftfahrzeugen),22,im Handelsregister eingetragen,Marzahn-Hellersdorf,10100315,Bärenstein,Marzahn Süd,Marzahn,Marzahn24861356454,Berlin,10777,52.499088738,13.337717803,661901,6619,66,0 Beschäftigte,Vermittlung v. Bausparverträgen,Sonstige mit Finanzdienstleistungen verbundene Tätigkeiten,Mit Finanz- u. Versicherungsdienstleistungen verbundene Täti,22,im Handelsregister eingetragen,Charlottenburg-Wilmersdorf,04501045,Schaperstraße,Lietzenburger Straße,Wilmersdorf Zentrum,Wilmersdorf24865556622,Berlin,10969,52.497740281,13.405772588,47622,4762,47,1 - 3 Beschäftigte,"EH m. Schreib- u. Papierwaren, Schul- u. Büroartikeln","EH m. Zeitschriften, Zeitungen, Schreibwaren u. Bürobedarf",Einzelhandel (ohne Handel mit Kraftfahrzeugen),22,im Handelsregister eingetragen,Friedrichshain-Kreuzberg,02100106,Wassertorplatz,Südliche  Friedrichstadt,Kreuzberg Nord,Kreuzberg244457561830,Berlin,14199,52.480148974,13.289261738,85599,8559,85,0 Beschäftigte,Unterricht a. n. g.,Sonstiger Unterricht a. n. g.,Erziehung u. Unterricht,23,im Handelsregister eingetragen,Charlottenburg-Wilmersdorf,04400830,Forckenbeckstraße,Schmargendorf,Wilmersdorf Süd,Schmargendorf245351561406,Berlin,10969,52.499368754,13.412302563,463990,4639,46,1 - 3 Beschäftigte,"GH m. Hotel-, Gaststätten u. Imbiss-Stubenbedarf","GH m. Nahrungs- u. Genussmitteln, Getränken u. Tabakwaren, o",Großhandel (ohne Handel mit Kraftfahrzeugen u. Krafträdern),22,im Handelsregister eingetragen,Friedrichshain-Kreuzberg,02100105,Prinzenstraße,Südliche  Friedrichstadt,Kreuzberg Nord,Kreuzberg244296061184,Berlin,13349,52.557857948,13.344647437,62020,6202,62,0 Beschäftigte,Erbringung v. Beratungsleistungen auf dem Gebiet der Informa,Erbringung v. Beratungsleistungen auf dem Gebiet der Informa,Erbringung v. Dienstleistungen der Informationstechnologie,22,im Handelsregister eingetragen,Mitte,01400939,Glasgower Straße,Parkviertel,Wedding,Wedding24152756110,Berlin,13351,52.554046686,13.338626137,56101,5610,56,0 Beschäftigte,Restaurants mit herkömmlicher Bedienung,"Restaurants, Gaststätten, Imbissstuben, Cafés, Eissalons u.",Gastronomie,23,im Handelsregister eingetragen,Mitte,01400937,Afrikanische Straße,Parkviertel,Wedding,Wedding25166106644,Berlin,10559,52.530613915,13.35123242,81100,8110,81,0 Beschäftigte,Hausmeisterdienste,Hausmeisterdienste,Gebäudebetreuung; Garten- u. Landschaftsbau,22,im Handelsregister eingetragen,Mitte,01200623,Stephankiez,Moabit Ost,Moabit,Moabit25073856954,Berlin,10717,52.487558261,13.32352919,451102,4511,45,1 - 3 Beschäftigte,EH m. gebrauchten Kraftwagen,"Handel m. Kraftwagen mit einem Gesamtgewicht v. 3,5 t oder w",Handel mit Kraftfahrzeugen; Instandhaltung u. Reparatur v. K,22,im Handelsregister eingetragen,Charlottenburg-Wilmersdorf,04501149,Nikolsburger Platz,Volkspark Wilmersdorf,Wilmersdorf Zentrum,Wilmersdorf271965061860,Berlin,13503,52.607323727,13.241579573,4690,4690,46,1 - 3 Beschäftigte,GH ohne ausgeprägten Schwerpunkt,GH ohne ausgeprägten Schwerpunkt,Großhandel (ohne Handel mit Kraftfahrzeugen u. Krafträdern),21,Kleingewerbetreibender,Reinickendorf,12400619,Heiligensee,West 2 - Heiligensee/Konradshöhe,Grüner Norden,Heiligensee264401061604,Berlin,12619,52.5192943,13.592083668,46179,4617,46,0 Beschäftigte,"HV v. sonstigen Nahrungsmitteln, Getränken u. Tabakwaren","HV v. Nahrungsmitteln, Getränken u. Tabakwaren",Großhandel (ohne Handel mit Kraftfahrzeugen u. Krafträdern),21,im Handelsregister eingetragen,Marzahn-Hellersdorf,10200630,Cecilienplatz,Hellersdorf Süd,Hellersdorf,Hellersdorf265943561774,Berlin,12679,52.55053876,13.56267979,532004,5320,53,0 Beschäftigte,Kurierdienste,"Sonstige Post-, Kurier- u. Expressdienste","Post-, Kurier- u. Expressdienste",21,im Handelsregister eingetragen,Marzahn-Hellersdorf,10100209,Lea-Grundig-Straße,Marzahn Mitte,Marzahn,Marzahn26804356174,Berlin,10437,52.543210291,13.414396284,702200,7022,70,1 - 3 Beschäftigte,Management u. Marketingberatung (Projektmanagement),Unternehmensberatung,Verwaltung u. Führung v. Unternehmen u. Betrieben; Unternehm,21,Kleingewerbetreibender,Pankow,03601346,Gethsemanekirche,Helmholtzplatz,Nördlicher Prenzlauer Berg,Prenzlauer Berg26121606864,Berlin,14055,52.49678464,13.26535093,47750,4775,47,0 Beschäftigte,EH m. kosmetischen Erzeugnissen u. Körperpflegemitteln,EH m. kosmetischen Erzeugnissen u. Körperpflegemitteln,Einzelhandel (ohne Handel mit Kraftfahrzeugen),22,im Handelsregister eingetragen,Charlottenburg-Wilmersdorf,04200207,Eichkamp,Heerstraße,Charlottenburg West,Westend263314061256,Berlin,10117,52.511983119,13.39133917,86909,8690,86,7 - 9 Beschäftigte,Sonstige selbstständige Tätigkeiten im Gesundheitswesen,Gesundheitswesen a. n. g.,Gesundheitswesen,22,Kleingewerbetreibender,Mitte,01100207,Leipziger Straße,Regierungsviertel,Zentrum,Mitte26268406736,Berlin,10965,52.491629647,13.378738784,6810,6810,68,1 - 3 Beschäftigte,"Kauf u. Verkauf v. eigenen Grundstücken, Gebäuden u. Wohnung","Kauf u. Verkauf v. eigenen Grundstücken, Gebäuden u. Wohnung",Grundstücks- u. Wohnungswesen,22,Kleingewerbetreibender,Friedrichshain-Kreuzberg,02200209,Viktoriapark,Tempelhofer Vorstadt,Kreuzberg Süd,Kreuzberg27469956798,Berlin,12051,52.464845824,13.439854065,532005,5320,53,0 Beschäftigte,Erbringung v. sonstigen postalischen Dienstleistungen,"Sonstige Post-, Kurier- u. Expressdienste","Post-, Kurier- u. Expressdienste",21,im Handelsregister eingetragen,Neukölln,08100209,Glasower Straße,Neuköllner Mitte/Zentrum,Neukölln,Neukölln27170256810,Berlin,12459,52.456765775,13.529711329,77290,7729,77,0 Beschäftigte,Vermietung v. sonstigen Gebrauchsgütern,Vermietung v. sonstigen Gebrauchsgütern,Vermietung v. beweglichen Sachen,21,im Handelsregister eingetragen,Treptow-Köpenick,09200512,Wuhlheide,Oberschöneweide,Treptow-Köpenick 2,Oberschöneweide290251561006,Berlin,14199,52.48102523,13.288484377,68,68,68,10 - 19 Beschäftigte,Grundstücks- u. Wohnungswesen,Grundstücks- u. Wohnungswesen,Grundstücks- u. Wohnungswesen,21,Kleingewerbetreibender,Charlottenburg-Wilmersdorf,04400830,Forckenbeckstraße,Schmargendorf,Wilmersdorf Süd,Schmargendorf28559356374,Berlin,13597,52.526344384,13.218173653,96090,9609,96,0 Beschäftigte,Erbringung v. sonstigen Dienstleistungen a. n. g.,Erbringung v. sonstigen Dienstleistungen a. n. g.,Erbringung v. sonstigen überwiegend persönlichen Dienstleist,21,im Handelsregister eingetragen,Spandau,05200632,Tiefwerder,Wilhelmstadt,Wilhelmstadt / Staaken,Wilhelmstadt29373506940,Berlin,12167,52.447562294,13.341715989,62020,6202,62,0 Beschäftigte,Erbringung v. Beratungsleistungen auf dem Gebiet der Informa,Erbringung v. Beratungsleistungen auf dem Gebiet der Informa,Erbringung v. Dienstleistungen der Informationstechnologie,21,im Handelsregister eingetragen,Steglitz-Zehlendorf,06100205,Südende,Albrechtstraße,Steglitz,Steglitz28463106524,Berlin,14163,52.429454296,13.234633842,68,68,68,1 - 3 Beschäftigte,Grundstücks- u. Wohnungswesen,Grundstücks- u. Wohnungswesen,Grundstücks- u. Wohnungswesen,21,Kleingewerbetreibender,Steglitz-Zehlendorf,06300524,Berlepschstraße,Teltower Damm,Zehlendorf Süd/Lichterfelde West,Zehlendorf30570406816,Berlin,10318,52.488924878,13.524630343,433200,4332,43,0 Beschäftigte,"Einbau v. genormten Baufertigteilen (z.B. Fenster, Türen, Za",Bautischlerei u. -schlosserei,"Vorbereitende Baustellenarbeiten, Bauinstallation u. sonstig",20,im Handelsregister eingetragen,Lichtenberg,11501339,Karlshorst West,Karlshorst,Lichtenberg Süd,Karlshorst30360606424,Berlin,12307,52.388796703,13.385772586,749,749,74,10 - 19 Beschäftigte,"Sonstige freiberufliche, wissenschaftliche u. technische Tät","Sonstige freiberufliche, wissenschaftliche u. technische Tät","Sonstige freiberufliche, wissenschaftliche u. technische Tät",20,Kleingewerbetreibender,Tempelhof-Schöneberg,07601546,Franziusweg,Lichtenrade Süd,Marienfelde / Lichtenrade,Lichtenrade