opendata_id,city,postcode,latitude,longitude,ihk_branch_id,nace_id,branch_top_level_id,employees_range,ihk_branch_desc,nace_desc,branch_top_level_desc,business_age,business_type,Bezirk,planungsraum_id,Planungsraum,Bezirksregion,Prognoseraum,Ortsteil118211227374,Berlin,13355,52.538326925,13.389458626,47540,4754,47,0 Beschäftigte,EH m. elektrischen Haushaltsgeräten,EH m. elektrischen Haushaltsgeräten,Einzelhandel (ohne Handel mit Kraftfahrzeugen),2,im Handelsregister eingetragen,Mitte,01300835,Humboldthain Süd,Brunnenstraße Nord,Gesundbrunnen,Gesundbrunnen1156171271904,Berlin,12105,52.455219804,13.378971273,64200,6420,64,1 - 3 Beschäftigte,Beteiligungsgesellschaften,Beteiligungsgesellschaften,Erbringung v. Finanzdienstleistungen,3,Kleingewerbetreibender,Tempelhof-Schöneberg,07400825,Friedrich-Karl-Straße,Tempelhof Südwest,Tempelhof,Tempelhof1170970871236,Berlin,10969,52.50436196,13.390142311,479198,4791,47,0 Beschäftigte,Verkauf über Internet / e-commerce / Onlinehandel,Versand- u. Interneteinzelhandel,Einzelhandel (ohne Handel mit Kraftfahrzeugen),3,im Handelsregister eingetragen,Friedrichshain-Kreuzberg,02100102,Mehringplatz,Südliche  Friedrichstadt,Kreuzberg Nord,Kreuzberg1184773871246,Berlin,12157,52.461164634,13.336660784,741031,7410,74,0 Beschäftigte,Innendekorateur,"Ateliers f. Textil-, Schmuck-, Grafik- u. ä. Design","Sonstige freiberufliche, wissenschaftliche u. technische Tät",2,im Handelsregister eingetragen,Steglitz-Zehlendorf,06100209,Feuerbachstraße,Albrechtstraße,Steglitz,Steglitz118986307210,Berlin,10829,52.478629325,13.353911319,64200,6420,64,4 - 6 Beschäftigte,Beteiligungsgesellschaften,Beteiligungsgesellschaften,Erbringung v. Finanzdienstleistungen,2,Kleingewerbetreibender,Tempelhof-Schöneberg,07300619,Grazer Platz,Friedenau Ost,Friedenau,Schöneberg1178390471968,Berlin,10589,52.525237802,13.299453861,351124,3511,35,1 - 3 Beschäftigte,Stromerzeugung aus Photovoltaikanlagen,Elektrizitätserzeugung,Energieversorgung,3,Kleingewerbetreibender,Charlottenburg-Wilmersdorf,04300517,Tegeler Weg,Mierendorffplatz,Charlottenburg Zentrum,Charlottenburg11550204768,Berlin,10179,52.511350516,13.416848099,63120,6312,63,1 - 3 Beschäftigte,Webportale,Webportale,Informationsdienstleistungen,3,Kleingewerbetreibender,Mitte,01100313,Heine-Viertel Ost,Alexanderplatz,Zentrum,Mitte118275967532,Berlin,10245,52.511282804,13.456608866,56301,5630,56,1 - 3 Beschäftigte,Schankwirtschaften,Ausschank v. Getränken,Gastronomie,2,im Handelsregister eingetragen,Friedrichshain-Kreuzberg,02500833,Boxhagener Platz,Frankfurter Allee Süd FK,Friedrichshain Ost,Friedrichshain1168702871676,Berlin,10719,52.496166128,13.329476392,731109,7311,73,1 - 3 Beschäftigte,"Direktmarketing Planung, Durchführung",Werbeagenturen,Werbung u. Marktforschung,3,Kleingewerbetreibender,Mitte,01100207,Leipziger Straße,Regierungsviertel,Zentrum,Mitte118336267542,Berlin,10719,52.502546208,13.331438909,6810,6810,68,unbekannt,"Kauf u. Verkauf v. eigenen Grundstücken, Gebäuden u. Wohnung","Kauf u. Verkauf v. eigenen Grundstücken, Gebäuden u. Wohnung",Grundstücks- u. Wohnungswesen,7,Kleingewerbetreibender,Charlottenburg-Wilmersdorf,04501042,Breitscheidplatz,Lietzenburger Straße,Wilmersdorf Zentrum,Charlottenburg1167995471318,Berlin,10247,52.515037552,13.468116796,56101,5610,56,4 - 6 Beschäftigte,Restaurants mit herkömmlicher Bedienung,"Restaurants, Gaststätten, Imbissstuben, Cafés, Eissalons u.",Gastronomie,3,im Handelsregister eingetragen,Friedrichshain-Kreuzberg,02500729,Pettenkofer Straße,Frankfurter Allee Nord,Friedrichshain Ost,Friedrichshain1163938271794,Berlin,10823,52.486458736,13.355817462,56103,5610,56,0 Beschäftigte,Imbissstuben u.ä.,"Restaurants, Gaststätten, Imbissstuben, Cafés, Eissalons u.",Gastronomie,3,im Handelsregister eingetragen,Tempelhof-Schöneberg,07200409,Belziger Straße,Schöneberg Südost,Schöneberg Süd,Schöneberg116429767992,Berlin,12487,52.444532444,13.517569217,56103,5610,56,0 Beschäftigte,Imbissstuben u.ä.,"Restaurants, Gaststätten, Imbissstuben, Cafés, Eissalons u.",Gastronomie,3,im Handelsregister eingetragen,Treptow-Köpenick,09100409,Landschaftspark Adlershof,Johannisthal,Treptow-Köpenick 1,Johannisthal1166934671782,Berlin,12051,52.470011079,13.428124044,70220,7022,70,0 Beschäftigte,Unternehmensberatung,Unternehmensberatung,Verwaltung u. Führung v. Unternehmen u. Betrieben; Unternehm,3,im Handelsregister eingetragen,Neukölln,08100104,Wartheplatz,Schillerpromenade,Neukölln,Neukölln1186728671762,Berlin,10781,52.496704284,13.356091382,63120,6312,63,0 Beschäftigte,Webportale,Webportale,Informationsdienstleistungen,2,im Handelsregister eingetragen,Tempelhof-Schöneberg,07100103,Frobenstraße,Schöneberg Nordwest,Schöneberg Nord,Schöneberg118047547918,Berlin,13353,52.549832012,13.352565332,47210,4721,47,1 - 3 Beschäftigte,"EH m. Obst, Gemüse u. Kartoffeln","EH m. Obst, Gemüse u. Kartoffeln",Einzelhandel (ohne Handel mit Kraftfahrzeugen),2,im Handelsregister eingetragen,Mitte,01400942,Westliche Müllerstraße,Parkviertel,Wedding,Wedding1193206871356,Berlin,13587,52.564824921,13.212123267,43210,4321,43,1 - 3 Beschäftigte,Elektroinstallation,Elektroinstallation,"Vorbereitende Baustellenarbeiten, Bauinstallation u. sonstig",2,Kleingewerbetreibender,Treptow-Köpenick,09200613,Bahnhof Schöneweide,Niederschöneweide,Treptow-Köpenick 2,Niederschöneweide116959687656,Berlin,10787,52.50205131,13.349254781,620113,6201,62,0 Beschäftigte,Gestaltung v. Internet-Angeboten / Homepagedesign /Webdesign,Programmierungstätigkeiten,Erbringung v. Dienstleistungen der Informationstechnologie,3,im Handelsregister eingetragen,Tempelhof-Schöneberg,07100102,Kalckreuthstraße,Schöneberg Nordwest,Schöneberg Nord,Schöneberg1190163071210,Berlin,13503,52.610608732,13.238149394,47610,4761,47,0 Beschäftigte,EH m. Büchern,EH m. Büchern,Einzelhandel (ohne Handel mit Kraftfahrzeugen),2,im Handelsregister eingetragen,Reinickendorf,12400619,Heiligensee,West 2 - Heiligensee/Konradshöhe,Grüner Norden,Heiligensee1168107071690,Berlin,12045,52.48188868,13.444174854,439990,4399,43,0 Beschäftigte,Fassadenbau,Sonstige spezialisierte Bautätigkeiten a. n. g.,"Vorbereitende Baustellenarbeiten, Bauinstallation u. sonstig",3,im Handelsregister eingetragen,Neukölln,08100418,Hertzbergplatz,Rixdorf,Neukölln,Neukölln119184907830,Berlin,14169,52.439130388,13.272876517,531001,5310,53,0 Beschäftigte,Post- u. Paketshop (Annahmestelle),Postdienste v. Universaldienstleistungsanbietern,"Post-, Kurier- u. Expressdienste",2,im Handelsregister eingetragen,Steglitz-Zehlendorf,06400841,Zehlendorf Eiche,Zehlendorf Nord,Zehlendorf Nord/Wannsee,Zehlendorf1193887271624,Berlin,10437,52.542141097,13.41382522,59130,5913,59,1 - 3 Beschäftigte,Filmverleih u. -vertrieb (ohne Videotheken),Filmverleih u. -vertrieb (ohne Videotheken),"Herstellung, Verleih u. Vertrieb v. Filmen u. Fernsehprogram",2,Kleingewerbetreibender,Pankow,03601347,Helmholtzplatz,Helmholtzplatz,Nördlicher Prenzlauer Berg,Prenzlauer Berg116167327244,Berlin,12623,52.484606824,13.618677213,432911,4329,43,0 Beschäftigte,Akustik- u. Trockenbau,Sonstige Bauinstallation,"Vorbereitende Baustellenarbeiten, Bauinstallation u. sonstig",3,im Handelsregister eingetragen,Marzahn-Hellersdorf,10400941,Pilgramer Straße,Mahlsdorf,Kaulsdorf/Mahlsdorf,Mahlsdorf1159192871976,Berlin,10551,52.527020737,13.33563119,823000,8230,82,0 Beschäftigte,Durchführung v. Veranstaltungen  / Veranstaltungsservice,"Messe-, Ausstellungs- u. Kongressveranstalter",Erbringung v. wirtschaftlichen Dienstleistungen f. Unternehm,3,im Handelsregister eingetragen,Mitte,01200520,Bremer Straße,Moabit West,Moabit,Moabit1159201274,Berlin,12045,52.486614098,13.438205878,741010,7410,74,1 - 3 Beschäftigte,Modedesign,"Ateliers f. Textil-, Schmuck-, Grafik- u. ä. Design","Sonstige freiberufliche, wissenschaftliche u. technische Tät",3,im Handelsregister eingetragen,Neukölln,08100312,Weichselplatz,Reuterstraße,Neukölln,Neukölln1182601876,Berlin,12049,52.48196415,13.424558492,47111,4711,47,0 Beschäftigte,"EH m. Nahrungs- u. Genussmitteln, Getränken u. Tabakwaren, o","EH m. Waren verschiedener Art, Hauptrichtung Nahrungs- u. Ge",Einzelhandel (ohne Handel mit Kraftfahrzeugen),2,im Handelsregister eingetragen,Neukölln,08100101,Hasenheide,Schillerpromenade,Neukölln,Neukölln1194372071240,Berlin,10965,52.491472371,13.386317355,10520,1052,10,7 - 9 Beschäftigte,H. v. Speiseeis,H. v. Speiseeis,H. v. Nahrungs- u. Futtermitteln,2,Kleingewerbetreibender,Friedrichshain-Kreuzberg,02200209,Viktoriapark,Tempelhofer Vorstadt,Kreuzberg Süd,Kreuzberg1174135871786,Berlin,13357,52.545799402,13.379632397,494108,4941,49,0 Beschäftigte,Erlaubnisfreier u. freigestellter Straßengüterverkehr (ohne,Güterbeförderung im Straßenverkehr,Landverkehr u. Transport in Rohrfernleitungen,3,Kleingewerbetreibender,Mitte,01300836,Humboldthain Nordwest,Brunnenstraße Nord,Gesundbrunnen,Gesundbrunnen115639747658,Berlin,10243,52.508036804,13.450176255,46399,4639,46,50 - 99 Beschäftigte,"GH m. sonstigen Nahrungs- u. Genussmitteln, Getränken u. Tab","GH m. Nahrungs- u. Genussmitteln, Getränken u. Tabakwaren, o",Großhandel (ohne Handel mit Kraftfahrzeugen u. Krafträdern),4,Kleingewerbetreibender,Friedrichshain-Kreuzberg,02400624,Weberwiese,Karl-Marx-Allee Süd,Friedrichshain West,Friedrichshain1186179071930,Berlin,10119,52.53100174,13.408448169,821100,8211,82,0 Beschäftigte,Büroservice,Allgemeine Sekretariats- u. Schreibdienste,Erbringung v. wirtschaftlichen Dienstleistungen f. Unternehm,7,im Handelsregister eingetragen,Pankow,03701554,Teutoburger Platz,Prenzlauer Berg Südwest,Südlicher Prenzlauer Berg,Prenzlauer Berg117551707390,Berlin,13125,52.639445713,13.521540827,77110,7711,77,0 Beschäftigte,"Vermietung v. Kraftwagen mit einem Gesamtgewicht v. 3,5 t od","Vermietung v. Kraftwagen mit einem Gesamtgewicht v. 3,5 t od",Vermietung v. beweglichen Sachen,3,im Handelsregister eingetragen,Pankow,03100102,Klinikum Buch,Buch,Buch,Buch1178137871126,Berlin,10967,52.490721761,13.421960217,70220,7022,70,1 - 3 Beschäftigte,Unternehmensberatung,Unternehmensberatung,Verwaltung u. Führung v. Unternehmen u. Betrieben; Unternehm,3,Kleingewerbetreibender,Friedrichshain-Kreuzberg,02200213,Graefekiez Nord,Tempelhofer Vorstadt,Kreuzberg Süd,Kreuzberg118757767592,Berlin,10437,52.543079172,13.420022181,900200,9002,90,0 Beschäftigte,Dienstleistung im Bereich Veranstaltungstechnik,Erbringung v. Dienstleistungen f. die darstellende Kunst,"Kreative, künstlerische u. unterhaltende Tätigkeiten",2,im Handelsregister eingetragen,Pankow,03601347,Helmholtzplatz,Helmholtzplatz,Nördlicher Prenzlauer Berg,Prenzlauer Berg1153013471378,Berlin,13629,52.544189879,13.256378696,479198,4791,47,0 Beschäftigte,Verkauf über Internet / e-commerce / Onlinehandel,Versand- u. Interneteinzelhandel,Einzelhandel (ohne Handel mit Kraftfahrzeugen),3,im Handelsregister eingetragen,Spandau,05300839,Rohrdamm,Siemensstadt,Haselhorst / Siemensstadt,Siemensstadt1165762871876,Berlin,12043,52.483977137,13.429993436,910200,9102,91,0 Beschäftigte,Galerien,Museen,"Bibliotheken, Archive, Museen, botanische u. zoologische Gär",3,im Handelsregister eingetragen,Neukölln,08100314,Donaustraße,Reuterstraße,Neukölln,Neukölln1178210471368,Berlin,12627,52.54134767,13.623595028,432911,4329,43,0 Beschäftigte,Akustik- u. Trockenbau,Sonstige Bauinstallation,"Vorbereitende Baustellenarbeiten, Bauinstallation u. sonstig",3,im Handelsregister eingetragen,Marzahn-Hellersdorf,10200423,Böhlener Straße,Hellersdorf Nord,Hellersdorf,Hellersdorf118695247508,Berlin,13088,52.548607374,13.451562638,56104,5610,56,1 - 3 Beschäftigte,Cafés,"Restaurants, Gaststätten, Imbissstuben, Cafés, Eissalons u.",Gastronomie,3,im Handelsregister eingetragen,Pankow,03500935,Behaimstraße,Weißensee,Südliches Weißensee,Weißensee119049187306,Berlin,10557,52.515497842,13.339554554,32990,3299,32,1 - 3 Beschäftigte,H. v. sonstigen Erzeugnissen a. n. g.,H. v. sonstigen Erzeugnissen a. n. g.,H. v. sonstigen Waren,5,Kleingewerbetreibender,Mitte,01200629,Hansaviertel,Moabit Ost,Moabit,Hansaviertel119726767892,Berlin,10245,52.506169778,13.460299232,62019,6201,62,1 - 3 Beschäftigte,Sonstige Softwareentwicklung,Programmierungstätigkeiten,Erbringung v. Dienstleistungen der Informationstechnologie,4,im Handelsregister eingetragen,Friedrichshain-Kreuzberg,02500834,Revaler Straße,Frankfurter Allee Süd FK,Friedrichshain Ost,Friedrichshain1149360671202,Berlin,13591,52.526160647,13.136869807,4941080,4941,49,0 Beschäftigte,Lieferservice,Güterbeförderung im Straßenverkehr,Landverkehr u. Transport in Rohrfernleitungen,3,im Handelsregister eingetragen,Spandau,05200524,Döberitzer Weg,Heerstraße,Wilhelmstadt / Staaken,Staaken1155341471138,Berlin,10178,52.520835437,13.4137717,47710,4771,47,20 - 49 Beschäftigte,EH m. Bekleidung,EH m. Bekleidung,Einzelhandel (ohne Handel mit Kraftfahrzeugen),4,Kleingewerbetreibender,Mitte,01100310,Alexanderplatzviertel,Alexanderplatz,Zentrum,Mitte114984667822,Berlin,10247,52.512354814,13.469063519,6810,6810,68,1 - 3 Beschäftigte,"Kauf u. Verkauf v. eigenen Grundstücken, Gebäuden u. Wohnung","Kauf u. Verkauf v. eigenen Grundstücken, Gebäuden u. Wohnung",Grundstücks- u. Wohnungswesen,3,Kleingewerbetreibender,Friedrichshain-Kreuzberg,02500831,Wismarplatz,Frankfurter Allee Süd FK,Friedrichshain Ost,Friedrichshain1165540871136,Berlin,10317,52.503409661,13.487020603,5911,5911,59,unbekannt,"H. v. Filmen, Videofilmen u. Fernsehprogrammen","H. v. Filmen, Videofilmen u. Fernsehprogrammen","Herstellung, Verleih u. Vertrieb v. Filmen u. Fernsehprogram",8,im Handelsregister eingetragen,Lichtenberg,11400929,Weitlingkiez,Neu-Lichtenberg,Lichtenberg Mitte,Rummelsburg119523007100,Berlin,12619,52.520850542,13.590450186,56103,5610,56,1 - 3 Beschäftigte,Imbissstuben u.ä.,"Restaurants, Gaststätten, Imbissstuben, Cafés, Eissalons u.",Gastronomie,2,im Handelsregister eingetragen,Marzahn-Hellersdorf,10200630,Cecilienplatz,Hellersdorf Süd,Hellersdorf,Hellersdorf115987807260,Berlin,13407,52.572333693,13.349454265,829992,8299,82,0 Beschäftigte,Vermittlung v. Aufträgen / Verträgen / Unternehmensdienstlei,Erbringung sonstiger wirtschaftlicher Dienstleistungen f. Un,Erbringung v. wirtschaftlichen Dienstleistungen f. Unternehm,3,im Handelsregister eingetragen,Reinickendorf,12100205,Teichstraße,Ost 2 - Alt-Reinickendorf,Reinickendorf Ost,Reinickendorf1184394671982,Berlin,12555,52.45918611,13.580232342,821100,8211,82,0 Beschäftigte,Büroservice,Allgemeine Sekretariats- u. Schreibdienste,Erbringung v. wirtschaftlichen Dienstleistungen f. Unternehm,2,im Handelsregister eingetragen,Treptow-Köpenick,09502042,Mittelheide,Köpenick Nord,Treptow-Köpenick 5,Köpenick119350927364,Berlin,10405,52.529250073,13.418318129,81100,8110,81,0 Beschäftigte,Hausmeisterdienste,Hausmeisterdienste,Gebäudebetreuung; Garten- u. Landschaftsbau,2,im Handelsregister eingetragen,Pankow,03701659,Immanuelkirchstraße,Prenzlauer Berg Süd,Südlicher Prenzlauer Berg,Prenzlauer Berg11880270790,Berlin,13507,52.584519409,13.28262011,475402,4754,47,1 - 3 Beschäftigte,EH m. Elektronik u. elektronischen Erzeugnissen,EH m. elektrischen Haushaltsgeräten,Einzelhandel (ohne Handel mit Kraftfahrzeugen),3,Kleingewerbetreibender,Reinickendorf,12200515,Alt-Tegel,West 5 - Tegel,Tegel,Tegel117126427214,Berlin,12051,52.46882226,13.437449458,74201,7420,74,0 Beschäftigte,Fotografie,Fotografie u. Fotolabors,"Sonstige freiberufliche, wissenschaftliche u. technische Tät",3,im Handelsregister eingetragen,Neukölln,08100208,Körnerpark,Neuköllner Mitte/Zentrum,Neukölln,Neukölln115391767392,Berlin,10787,52.503698731,13.344069005,49320,4932,49,20 - 49 Beschäftigte,Betrieb v. Taxis u. Mietwagen,Betrieb v. Taxis,Landverkehr u. Transport in Rohrfernleitungen,3,Kleingewerbetreibender,Tempelhof-Schöneberg,07100101,Wittenbergplatz,Schöneberg Nordwest,Schöneberg Nord,Schöneberg1158002478,Berlin,13469,52.617186348,13.3502615,682010,6820,68,1 - 3 Beschäftigte,"Verwaltung v. eigenen Grundstücken, Gebäuden u. Wohnungen","Vermietung, Verpachtung v. eigenen oder geleasten Grundstück",Grundstücks- u. Wohnungswesen,3,Kleingewerbetreibender,Reinickendorf,12500929,Lübars,Nord 2 - Waidmannslust/Wittenau/Lübars,Wittenau/Borsigwalde,Lübars1166795471318,Berlin,12109,52.449445323,13.384787345,47530,4753,47,0 Beschäftigte,"EH m. Vorhängen, Teppichen, Fußbodenbelägen u. Tapeten","EH m. Vorhängen, Teppichen, Fußbodenbelägen u. Tapeten",Einzelhandel (ohne Handel mit Kraftfahrzeugen),3,im Handelsregister eingetragen,Tempelhof-Schöneberg,07501030,Machonstraße,Mariendorf Nord,Mariendorf,Mariendorf1179512471708,Berlin,13467,52.616195269,13.316281049,661901,6619,66,0 Beschäftigte,Vermittlung v. Bausparverträgen,Sonstige mit Finanzdienstleistungen verbundene Tätigkeiten,Mit Finanz- u. Versicherungsdienstleistungen verbundene Täti,2,im Handelsregister eingetragen,Reinickendorf,12400723,Hermsdorf Ost/Waldsee,Nord 1 - Frohnau/Hermsdorf,Grüner Norden,Hermsdorf118885207840,Berlin,10367,52.530836463,13.485642589,10710,1071,10,0 Beschäftigte,H. v. Backwaren (ohne Dauerbackwaren),H. v. Backwaren (ohne Dauerbackwaren),H. v. Nahrungs- u. Futtermitteln,2,im Handelsregister eingetragen,Lichtenberg,11300721,Herzbergstraße,Alt-Lichtenberg,Lichtenberg Nord,Lichtenberg118809787326,Berlin,10318,52.486542823,13.523704867,479198,4791,47,0 Beschäftigte,Verkauf über Internet / e-commerce / Onlinehandel,Versand- u. Interneteinzelhandel,Einzelhandel (ohne Handel mit Kraftfahrzeugen),2,im Handelsregister eingetragen,Lichtenberg,11501339,Karlshorst West,Karlshorst,Lichtenberg Süd,Karlshorst119103727124,Berlin,10405,52.537107095,13.420770992,479198,4791,47,0 Beschäftigte,Verkauf über Internet / e-commerce / Onlinehandel,Versand- u. Interneteinzelhandel,Einzelhandel (ohne Handel mit Kraftfahrzeugen),2,im Handelsregister eingetragen,Pankow,03701555,Sredzkistraße,Prenzlauer Berg Südwest,Südlicher Prenzlauer Berg,Prenzlauer Berg119785807860,Berlin,13409,52.564917391,13.375674354,14190,1419,14,0 Beschäftigte,H. v. sonstiger Bekleidung u. Bekleidungszubehör a.n.g.,H. v. sonstiger Bekleidung u. Bekleidungszubehör a.n.g.,H. v. Bekleidung,2,im Handelsregister eingetragen,Reinickendorf,12100101,Letteplatz,Ost 1 - Reginhardstraße,Reinickendorf Ost,Reinickendorf119468287276,Berlin,13127,52.607089829,13.418844006,960906,9609,96,0 Beschäftigte,Entrümpelungsdienste,Erbringung v. sonstigen Dienstleistungen a. n. g.,Erbringung v. sonstigen überwiegend persönlichen Dienstleist,2,im Handelsregister eingetragen,Pankow,03200310,Krugpfuhl,Buchholz,Nördliches Pankow,Französisch Buchholz115159447648,Berlin,13507,52.586184589,13.288808182,479198,4791,47,0 Beschäftigte,Verkauf über Internet / e-commerce / Onlinehandel,Versand- u. Interneteinzelhandel,Einzelhandel (ohne Handel mit Kraftfahrzeugen),3,im Handelsregister eingetragen,Reinickendorf,12200515,Alt-Tegel,West 5 - Tegel,Tegel,Tegel1165133471778,Berlin,10317,52.505956999,13.500004998,49410,4941,49,4 - 6 Beschäftigte,Güterbeförderung im Straßenverkehr,Güterbeförderung im Straßenverkehr,Landverkehr u. Transport in Rohrfernleitungen,3,im Handelsregister eingetragen,Lichtenberg,11400929,Weitlingkiez,Neu-Lichtenberg,Lichtenberg Mitte,Rummelsburg1178800271334,Berlin,13187,52.568393543,13.39512109,64200,6420,64,1 - 3 Beschäftigte,Beteiligungsgesellschaften,Beteiligungsgesellschaften,Erbringung v. Finanzdienstleistungen,3,Kleingewerbetreibender,Pankow,03400721,Florakiez,Pankow Zentrum,Südliches Pankow,Pankow1175210471368,Berlin,12555,52.470085595,13.55932439,53200,5320,53,10 - 19 Beschäftigte,"Sonstige Post-, Kurier- u. Expressdienste","Sonstige Post-, Kurier- u. Expressdienste","Post-, Kurier- u. Expressdienste",3,Kleingewerbetreibender,Treptow-Köpenick,09502043,Dammheide,Köpenick Nord,Treptow-Köpenick 5,Köpenick118038727624,Berlin,12109,52.44533516,13.385573504,55909,5590,55,0 Beschäftigte,Sonstige Beherbergungsstätten a. n. g.,Sonstige Beherbergungsstätten,Beherbergung,3,im Handelsregister eingetragen,Tempelhof-Schöneberg,07501030,Machonstraße,Mariendorf Nord,Mariendorf,Mariendorf119106007200,Berlin,13591,52.540130391,13.129676138,68311,6831,68,0 Beschäftigte,"Vermittlung v. Wohngrundstücken, Wohngebäuden u. Wohnungen f","Vermittlung v. Grundstücken, Gebäuden u. Wohnungen f. Dritte",Grundstücks- u. Wohnungswesen,2,im Handelsregister eingetragen,Spandau,05200418,Isenburger Weg,Brunsbütteler Damm,Wilhelmstadt / Staaken,Staaken1191558671862,Berlin,12055,52.477006382,13.44765173,432911,4329,43,0 Beschäftigte,Akustik- u. Trockenbau,Sonstige Bauinstallation,"Vorbereitende Baustellenarbeiten, Bauinstallation u. sonstig",2,im Handelsregister eingetragen,Neukölln,08100415,Ganghoferstraße,Rixdorf,Neukölln,Neukölln1157733671112,Berlin,10365,52.52673424,13.489497509,46422,4642,46,0 Beschäftigte,GH m. Schuhen,GH m. Bekleidung u. Schuhen,Großhandel (ohne Handel mit Kraftfahrzeugen u. Krafträdern),4,im Handelsregister eingetragen,Lichtenberg,11300721,Herzbergstraße,Alt-Lichtenberg,Lichtenberg Nord,Lichtenberg117431587386,Berlin,10715,52.48262941,13.326313546,900142,9001,90,0 Beschäftigte,Musiker / Musikerin,Darstellende Kunst,"Kreative, künstlerische u. unterhaltende Tätigkeiten",3,im Handelsregister eingetragen,Charlottenburg-Wilmersdorf,04501151,Hildegardstraße,Volkspark Wilmersdorf,Wilmersdorf Zentrum,Wilmersdorf117438187606,Berlin,12489,52.435968038,13.559543363,86909,8690,86,0 Beschäftigte,Sonstige selbstständige Tätigkeiten im Gesundheitswesen,Gesundheitswesen a. n. g.,Gesundheitswesen,3,im Handelsregister eingetragen,Treptow-Köpenick,09200717,Dörpfeldstraße Ost,Adlershof,Treptow-Köpenick 2,Adlershof1184779271264,Berlin,10369,52.527343874,13.460666007,79120,7912,79,0 Beschäftigte,Reiseveranstalter,Reiseveranstalter,"Reisebüros, Reiseveranstalter u. Erbringung sonstiger Reserv",4,im Handelsregister eingetragen,Lichtenberg,11300618,Storkower Bogen,Fennpfuhl,Lichtenberg Nord,Fennpfuhl1197907871026,Berlin,10319,52.49281633,13.508263214,479198,4791,47,0 Beschäftigte,Verkauf über Internet / e-commerce / Onlinehandel,Versand- u. Interneteinzelhandel,Einzelhandel (ohne Handel mit Kraftfahrzeugen),2,im Handelsregister eingetragen,Lichtenberg,11401135,Dolgenseestraße,Friedrichsfelde Süd,Lichtenberg Mitte,Friedrichsfelde1175161271204,Berlin,10249,52.524010125,13.461708198,472400,4724,47,1 - 3 Beschäftigte,EH m. Backwaren,EH m. Back- u. Süßwaren,Einzelhandel (ohne Handel mit Kraftfahrzeugen),3,im Handelsregister eingetragen,Pankow,03601453,Alter Schlachthof,Prenzlauer Berg Ost,Nördlicher Prenzlauer Berg,Prenzlauer Berg11652036712,Berlin,10785,52.500484554,13.367465148,532004,5320,53,0 Beschäftigte,Kurierdienste,"Sonstige Post-, Kurier- u. Expressdienste","Post-, Kurier- u. Expressdienste",3,im Handelsregister eingetragen,Mitte,01100104,Körnerstraße,Tiergarten Süd,Zentrum,Tiergarten11652096732,Berlin,13351,52.549114982,13.343494743,479198,4791,47,0 Beschäftigte,Verkauf über Internet / e-commerce / Onlinehandel,Versand- u. Interneteinzelhandel,Einzelhandel (ohne Handel mit Kraftfahrzeugen),3,im Handelsregister eingetragen,Mitte,01400938,Kameruner Straße,Parkviertel,Wedding,Wedding119051167372,Berlin,13595,52.507538124,13.203438073,70220,7022,70,1 - 3 Beschäftigte,Unternehmensberatung,Unternehmensberatung,Verwaltung u. Führung v. Unternehmen u. Betrieben; Unternehm,3,Kleingewerbetreibender,Spandau,05200634,Börnicker Straße,Wilhelmstadt,Wilhelmstadt / Staaken,Wilhelmstadt11562120740,Berlin,13355,52.542458022,13.39152707,479198,4791,47,1 - 3 Beschäftigte,Verkauf über Internet / e-commerce / Onlinehandel,Versand- u. Interneteinzelhandel,Einzelhandel (ohne Handel mit Kraftfahrzeugen),3,Kleingewerbetreibender,Mitte,01300835,Humboldthain Süd,Brunnenstraße Nord,Gesundbrunnen,Gesundbrunnen1160781671272,Berlin,10115,52.529269386,13.389803799,731108,7311,73,0 Beschäftigte,"Promotion, Propagandisten",Werbeagenturen,Werbung u. Marktforschung,3,im Handelsregister eingetragen,Mitte,01100415,Invalidenstraße,Brunnenstraße Süd,Zentrum,Mitte11496216772,Berlin,12051,52.466214046,13.429212437,59110,5911,59,1 - 3 Beschäftigte,"H. v. Filmen, Videofilmen u. Fernsehprogrammen","H. v. Filmen, Videofilmen u. Fernsehprogrammen","Herstellung, Verleih u. Vertrieb v. Filmen u. Fernsehprogram",3,Kleingewerbetreibender,Neukölln,08100105,Silbersteinstraße,Schillerpromenade,Neukölln,Neukölln115388527284,Berlin,10439,52.554224738,13.411825302,62011,6201,62,1 - 3 Beschäftigte,Entwicklung u. Programmierung v. Internetpräsentationen,Programmierungstätigkeiten,Erbringung v. Dienstleistungen der Informationstechnologie,3,Kleingewerbetreibender,Pankow,03601139,Norweger Viertel,Prenzlauer Berg Nordwest,Nördlicher Prenzlauer Berg,Prenzlauer Berg1158933071110,Berlin,12459,52.462160955,13.513720741,7490010,7490,74,0 Beschäftigte,Vermögensverwaltung,"Sonstige freiberufliche, wissenschaftliche u. technische Tät","Sonstige freiberufliche, wissenschaftliche u. technische Tät",12,Kleingewerbetreibender,Treptow-Köpenick,09200510,Helmholtz-Kiez,Oberschöneweide,Treptow-Köpenick 2,Oberschöneweide1149546071820,Berlin,10115,52.536803054,13.394937376,64200,6420,64,1 - 3 Beschäftigte,Beteiligungsgesellschaften,Beteiligungsgesellschaften,Erbringung v. Finanzdienstleistungen,3,Kleingewerbetreibender,Mitte,01100415,Invalidenstraße,Brunnenstraße Süd,Zentrum,Mitte117308827294,Berlin,12099,52.458359557,13.400307253,701090,7010,70,1 - 3 Beschäftigte,Komplementärgesellschaften,Verwaltung u. Führung v. Unternehmen u. Betrieben,Verwaltung u. Führung v. Unternehmen u. Betrieben; Unternehm,6,Kleingewerbetreibender,Tempelhof-Schöneberg,07400927,Rathaus Tempelhof,Tempelhof Südost,Tempelhof,Tempelhof