opendata_id,city,postcode,latitude,longitude,ihk_branch_id,nace_id,branch_top_level_id,employees_range,ihk_branch_desc,nace_desc,branch_top_level_desc,business_age,business_type,Bezirk,planungsraum_id,Planungsraum,Bezirksregion,Prognoseraum,Ortsteil914202671342,Berlin,12487,52.445422613,13.5062099,43110,4311,43,1 - 3 Beschäftigte,Abbrucharbeiten,Abbrucharbeiten,"Vorbereitende Baustellenarbeiten, Bauinstallation u. sonstig",8,Kleingewerbetreibender,Treptow-Köpenick,09100408,Johannisthal Ost,Johannisthal,Treptow-Köpenick 1,Johannisthal912583271944,Berlin,10719,52.501002869,13.330690547,66190,6619,66,0 Beschäftigte,Sonstige mit Finanzdienstleistungen verbundene Tätigkeiten,Sonstige mit Finanzdienstleistungen verbundene Tätigkeiten,Mit Finanz- u. Versicherungsdienstleistungen verbundene Täti,9,Kleingewerbetreibender,Charlottenburg-Wilmersdorf,04501042,Breitscheidplatz,Lietzenburger Straße,Wilmersdorf Zentrum,Charlottenburg918598271994,Berlin,12347,52.452625659,13.427482153,20410,2041,20,10 - 19 Beschäftigte,"H. v. Seifen, Wasch-, Reinigungs- u. Poliermitteln","H. v. Seifen, Wasch-, Reinigungs- u. Poliermitteln",H. v. chemischen Erzeugnissen,9,Kleingewerbetreibender,Neukölln,08200624,Tempelhofer Weg,Britz Nord,Britz/Buckow,Britz9186234778,Berlin,14167,52.429861456,13.261628756,7490015,7490,74,1 - 3 Beschäftigte,Eventmanagement,"Sonstige freiberufliche, wissenschaftliche u. technische Tät","Sonstige freiberufliche, wissenschaftliche u. technische Tät",9,Kleingewerbetreibender,Steglitz-Zehlendorf,06300526,Zehlendorf Mitte,Teltower Damm,Zehlendorf Süd/Lichterfelde West,Zehlendorf912369671232,Berlin,13591,52.551577393,13.12959736,731108,7311,73,0 Beschäftigte,"Promotion, Propagandisten",Werbeagenturen,Werbung u. Marktforschung,9,im Handelsregister eingetragen,Spandau,05100207,An der Tränke,Falkenhagener Feld,Spandau Mitte / Nord,Staaken91272487416,Berlin,10961,52.493699743,13.399134112,47260,4726,47,0 Beschäftigte,EH m. Tabakwaren,EH m. Tabakwaren,Einzelhandel (ohne Handel mit Kraftfahrzeugen),8,im Handelsregister eingetragen,Friedrichshain-Kreuzberg,02200210,Urbanstraße,Tempelhofer Vorstadt,Kreuzberg Süd,Kreuzberg913139471798,Berlin,12587,52.453097453,13.622434373,74102,7410,74,0 Beschäftigte,Grafik- u. Kommunikationsdesign,"Ateliers f. Textil-, Schmuck-, Grafik- u. ä. Design","Sonstige freiberufliche, wissenschaftliche u. technische Tät",8,im Handelsregister eingetragen,Treptow-Köpenick,09501737,Alt-Friedrichshagen,Friedrichshagen,Treptow-Köpenick 5,Friedrichshagen920739671132,Berlin,10711,52.500745957,13.2982646,56101,5610,56,1 - 3 Beschäftigte,Restaurants mit herkömmlicher Bedienung,"Restaurants, Gaststätten, Imbissstuben, Cafés, Eissalons u.",Gastronomie,8,im Handelsregister eingetragen,Charlottenburg-Wilmersdorf,04500937,Halensee,Halensee,Wilmersdorf Zentrum,Halensee92124247808,Berlin,13357,52.551907181,13.381781881,47721,4772,47,0 Beschäftigte,EH m. Schuhen,EH m. Schuhen u. Lederwaren,Einzelhandel (ohne Handel mit Kraftfahrzeugen),8,im Handelsregister eingetragen,Mitte,01300836,Humboldthain Nordwest,Brunnenstraße Nord,Gesundbrunnen,Gesundbrunnen919742471808,Berlin,12524,52.420054425,13.522703079,432911,4329,43,10 - 19 Beschäftigte,Akustik- u. Trockenbau,Sonstige Bauinstallation,"Vorbereitende Baustellenarbeiten, Bauinstallation u. sonstig",8,Kleingewerbetreibender,Treptow-Köpenick,09300920,Dorf Altglienicke,Altglienicke,Treptow-Köpenick 3,Altglienicke92410207340,Berlin,10317,52.5066082,13.496466859,731108,7311,73,0 Beschäftigte,"Promotion, Propagandisten",Werbeagenturen,Werbung u. Marktforschung,8,im Handelsregister eingetragen,Lichtenberg,11400929,Weitlingkiez,Neu-Lichtenberg,Lichtenberg Mitte,Rummelsburg92105587186,Berlin,14050,52.518127335,13.279832348,829992,8299,82,20 - 49 Beschäftigte,Vermittlung v. Aufträgen / Verträgen / Unternehmensdienstlei,Erbringung sonstiger wirtschaftlicher Dienstleistungen f. Un,Erbringung v. wirtschaftlichen Dienstleistungen f. Unternehm,8,Kleingewerbetreibender,Charlottenburg-Wilmersdorf,04200311,Königin-Elisabeth-Straße,Westend,Charlottenburg West,Westend922504271014,Berlin,10179,52.514148959,13.40757621,82300,8230,82,1 - 3 Beschäftigte,"Messe-, Ausstellungs- u. Kongressveranstalter","Messe-, Ausstellungs- u. Kongressveranstalter",Erbringung v. wirtschaftlichen Dienstleistungen f. Unternehm,8,Kleingewerbetreibender,Mitte,01100312,Heine-Viertel West,Alexanderplatz,Zentrum,Mitte91923127104,Berlin,13189,52.556881667,13.414713171,56301,5630,56,4 - 6 Beschäftigte,Schankwirtschaften,Ausschank v. Getränken,Gastronomie,8,im Handelsregister eingetragen,Pankow,03400827,Trelleborger Viertel,Pankow Süd,Südliches Pankow,Pankow91943887796,Berlin,13465,52.636241364,13.294457785,59203,5920,59,0 Beschäftigte,Verlegen v. Musikalien,Tonstudios; H. v. Hörfunkbeiträgen; Verlegen v. bespielten T,"Herstellung, Verleih u. Vertrieb v. Filmen u. Fernsehprogram",9,im Handelsregister eingetragen,Reinickendorf,12400721,Frohnau Ost,Nord 1 - Frohnau/Hermsdorf,Grüner Norden,Frohnau924338471128,Berlin,10717,52.488800538,13.329012635,479198,4791,47,1 - 3 Beschäftigte,Verkauf über Internet / e-commerce / Onlinehandel,Versand- u. Interneteinzelhandel,Einzelhandel (ohne Handel mit Kraftfahrzeugen),8,Kleingewerbetreibender,Charlottenburg-Wilmersdorf,04501149,Nikolsburger Platz,Volkspark Wilmersdorf,Wilmersdorf Zentrum,Wilmersdorf9246108736,Berlin,14052,52.509571374,13.270514878,46734,4673,46,0 Beschäftigte,GH m. Baustoffen u. Bauelementen aus mineralischen Stoffen,"GH m. Holz, Baustoffen, Anstrichmitteln u. Sanitärkeramik",Großhandel (ohne Handel mit Kraftfahrzeugen u. Krafträdern),8,Kleingewerbetreibender,Charlottenburg-Wilmersdorf,04200310,Fürstenplatz,Westend,Charlottenburg West,Westend92361487716,Berlin,10405,52.536489538,13.422219536,472400,4724,47,0 Beschäftigte,EH m. Backwaren,EH m. Back- u. Süßwaren,Einzelhandel (ohne Handel mit Kraftfahrzeugen),8,im Handelsregister eingetragen,Pankow,03701555,Sredzkistraße,Prenzlauer Berg Südwest,Südlicher Prenzlauer Berg,Prenzlauer Berg921969671232,Berlin,13053,52.550424129,13.501102078,7022001,7022,70,10 - 19 Beschäftigte,Marketingberatung,Unternehmensberatung,Verwaltung u. Führung v. Unternehmen u. Betrieben; Unternehm,8,Kleingewerbetreibender,Lichtenberg,11200410,Malchower Weg,Alt-Hohenschönhausen Nord,Hohenschönhausen Süd,Alt-Hohenschönhausen92044207140,Berlin,12623,52.499050941,13.617358054,9609093,9609,96,0 Beschäftigte,Dienstleistungen im Gastgewerbe,Erbringung v. sonstigen Dienstleistungen a. n. g.,Erbringung v. sonstigen überwiegend persönlichen Dienstleist,8,im Handelsregister eingetragen,Steglitz-Zehlendorf,06300632,Schweizer Viertel,Drakestraße,Zehlendorf Süd/Lichterfelde West,Lichterfelde93024427814,Berlin,10555,52.524489117,13.329659482,920011,9200,92,0 Beschäftigte,Betrieb v. Spielautomaten,"Spiel-, Wett- u. Lotteriewesen","Spiel-, Wett- u. Lotteriewesen",8,im Handelsregister eingetragen,Mitte,01200521,Zwinglistraße,Moabit West,Moabit,Moabit927403271344,Berlin,10787,52.504018183,13.342511452,472400,4724,47,0 Beschäftigte,EH m. Backwaren,EH m. Back- u. Süßwaren,Einzelhandel (ohne Handel mit Kraftfahrzeugen),8,im Handelsregister eingetragen,Tempelhof-Schöneberg,07100101,Wittenbergplatz,Schöneberg Nordwest,Schöneberg Nord,Schöneberg93084427814,Berlin,10247,52.517561824,13.469847886,68311,6831,68,0 Beschäftigte,"Vermittlung v. Wohngrundstücken, Wohngebäuden u. Wohnungen f","Vermittlung v. Grundstücken, Gebäuden u. Wohnungen f. Dritte",Grundstücks- u. Wohnungswesen,8,im Handelsregister eingetragen,Friedrichshain-Kreuzberg,02500729,Pettenkofer Straße,Frankfurter Allee Nord,Friedrichshain Ost,Friedrichshain930498071660,Berlin,12681,52.56138244,13.552327053,70220,7022,70,1 - 3 Beschäftigte,Unternehmensberatung,Unternehmensberatung,Verwaltung u. Führung v. Unternehmen u. Betrieben; Unternehm,8,Kleingewerbetreibender,Marzahn-Hellersdorf,10100205,Gewerbegebiet Bitterfelder Straße,Marzahn Mitte,Marzahn,Marzahn93307687256,Berlin,13467,52.619134456,13.309010676,463893,4638,46,1 - 3 Beschäftigte,GH m. Nahrungsergänzungsmitteln,GH m. sonstigen Nahrungs- u. Genussmitteln,Großhandel (ohne Handel mit Kraftfahrzeugen u. Krafträdern),8,Kleingewerbetreibender,Reinickendorf,12400723,Hermsdorf Ost/Waldsee,Nord 1 - Frohnau/Hermsdorf,Grüner Norden,Hermsdorf92590507350,Berlin,12047,52.486199968,13.429311641,56103,5610,56,0 Beschäftigte,Imbissstuben u.ä.,"Restaurants, Gaststätten, Imbissstuben, Cafés, Eissalons u.",Gastronomie,8,im Handelsregister eingetragen,Neukölln,08100314,Donaustraße,Reuterstraße,Neukölln,Neukölln925651271504,Berlin,10711,52.495159555,13.295062151,829992,8299,82,1 - 3 Beschäftigte,Vermittlung v. Aufträgen / Verträgen / Unternehmensdienstlei,Erbringung sonstiger wirtschaftlicher Dienstleistungen f. Un,Erbringung v. wirtschaftlichen Dienstleistungen f. Unternehm,8,im Handelsregister eingetragen,Charlottenburg-Wilmersdorf,04500938,Hochmeisterplatz,Halensee,Wilmersdorf Zentrum,Halensee92525887196,Berlin,10117,52.509861872,13.404351693,64200,6420,64,1 - 3 Beschäftigte,Beteiligungsgesellschaften,Beteiligungsgesellschaften,Erbringung v. Finanzdienstleistungen,8,Kleingewerbetreibender,Mitte,01100207,Leipziger Straße,Regierungsviertel,Zentrum,Mitte93127507250,Berlin,14193,52.490275702,13.277189201,464705,4647,46,0 Beschäftigte,"GH m. Teppichen, darunter abgepaßte Läufer, Kelims","GH m. Möbeln, Teppichen, Lampen u. Leuchten",Großhandel (ohne Handel mit Kraftfahrzeugen u. Krafträdern),8,im Handelsregister eingetragen,Charlottenburg-Wilmersdorf,04400726,Bismarckallee,Grunewald,Wilmersdorf Süd,Grunewald941977271924,Berlin,10117,52.508979446,13.377114968,464702,4647,46,0 Beschäftigte,"GH m. Kunstgegenständen, Sammlungen u. Sammlungsstücken (ohn","GH m. Möbeln, Teppichen, Lampen u. Leuchten",Großhandel (ohne Handel mit Kraftfahrzeugen u. Krafträdern),8,Kleingewerbetreibender,Mitte,01100205,Wilhelmstraße,Regierungsviertel,Zentrum,Mitte935734871116,Berlin,12589,52.442049029,13.704513364,4669,4669,46,1 - 3 Beschäftigte,GH m. sonstigen Maschinen u. Ausrüstungen,GH m. sonstigen Maschinen u. Ausrüstungen,Großhandel (ohne Handel mit Kraftfahrzeugen u. Krafträdern),9,Kleingewerbetreibender,Treptow-Köpenick,09501838,Rahnsdorf,Rahnsdorf,Treptow-Köpenick 5,Rahnsdorf934042271474,Berlin,13088,52.550725597,13.462742504,96090,9609,96,0 Beschäftigte,Erbringung v. sonstigen Dienstleistungen a. n. g.,Erbringung v. sonstigen Dienstleistungen a. n. g.,Erbringung v. sonstigen überwiegend persönlichen Dienstleist,8,im Handelsregister eingetragen,Pankow,03500936,Komponistenviertel Weißensee,Weißensee,Südliches Weißensee,Weißensee93848227274,Berlin,10318,52.480012629,13.514223596,4932,4932,49,0 Beschäftigte,Betrieb v. Taxis,Betrieb v. Taxis,Landverkehr u. Transport in Rohrfernleitungen,8,im Handelsregister eingetragen,Lichtenberg,11501341,Karlshorst Süd,Karlshorst,Lichtenberg Süd,Karlshorst941781671272,Berlin,13593,52.5094749,13.179744068,85599,8559,85,1 - 3 Beschäftigte,Unterricht a. n. g.,Sonstiger Unterricht a. n. g.,Erziehung u. Unterricht,8,Kleingewerbetreibender,Spandau,05200528,Weinmeisterhornweg,Heerstraße,Wilhelmstadt / Staaken,Wilhelmstadt942310271034,Berlin,10247,52.517429973,13.471794333,900141,9001,90,0 Beschäftigte,Diskjockey / Moderation / mobile Disko / Alleinunterhalter /,Darstellende Kunst,"Kreative, künstlerische u. unterhaltende Tätigkeiten",9,im Handelsregister eingetragen,Friedrichshain-Kreuzberg,02500729,Pettenkofer Straße,Frankfurter Allee Nord,Friedrichshain Ost,Friedrichshain93448387946,Berlin,12685,52.534495877,13.551300307,47761,4776,47,0 Beschäftigte,"EH m. Blumen, Pflanzen, Sämereien u. Düngemitteln","EH m. Blumen, Pflanzen, Sämereien, Düngemitteln, zoologische",Einzelhandel (ohne Handel mit Kraftfahrzeugen),8,im Handelsregister eingetragen,Marzahn-Hellersdorf,10100314,Auersbergstraße,Marzahn Süd,Marzahn,Marzahn935876471588,Berlin,10117,52.522969501,13.386709089,821100,8211,82,0 Beschäftigte,Büroservice,Allgemeine Sekretariats- u. Schreibdienste,Erbringung v. wirtschaftlichen Dienstleistungen f. Unternehm,8,Kleingewerbetreibender,Mitte,01100308,Charitéviertel,Alexanderplatz,Zentrum,Mitte93438487616,Berlin,12161,52.470636196,13.32808321,47111,4711,47,1 - 3 Beschäftigte,"EH m. Nahrungs- u. Genussmitteln, Getränken u. Tabakwaren, o","EH m. Waren verschiedener Art, Hauptrichtung Nahrungs- u. Ge",Einzelhandel (ohne Handel mit Kraftfahrzeugen),8,im Handelsregister eingetragen,Tempelhof-Schöneberg,07300516,Odenwaldstraße,Friedenau West,Friedenau,Friedenau935717471058,Berlin,13503,52.623135075,13.222253162,78300,7830,78,1 - 3 Beschäftigte,Sonstige Überlassung v. Arbeitskräften,Sonstige Überlassung v. Arbeitskräften,Vermittlung u. Überlassung v. Arbeitskräften,9,Kleingewerbetreibender,Reinickendorf,12400617,Alt-Heiligensee,West 2 - Heiligensee/Konradshöhe,Grüner Norden,Heiligensee940108871696,Berlin,14193,52.487172636,13.271134747,829992,8299,82,1 - 3 Beschäftigte,Vermittlung v. Aufträgen / Verträgen / Unternehmensdienstlei,Erbringung sonstiger wirtschaftlicher Dienstleistungen f. Un,Erbringung v. wirtschaftlichen Dienstleistungen f. Unternehm,8,Kleingewerbetreibender,Charlottenburg-Wilmersdorf,04400728,Hagenplatz,Grunewald,Wilmersdorf Süd,Grunewald93906787226,Berlin,12679,52.54577772,13.556280831,920011,9200,92,0 Beschäftigte,Betrieb v. Spielautomaten,"Spiel-, Wett- u. Lotteriewesen","Spiel-, Wett- u. Lotteriewesen",8,im Handelsregister eingetragen,Marzahn-Hellersdorf,10100210,Marzahner Promenade,Marzahn Mitte,Marzahn,Marzahn93855067502,Berlin,10317,52.507590182,13.49703403,47650,4765,47,0 Beschäftigte,EH m. Spielwaren,EH m. Spielwaren,Einzelhandel (ohne Handel mit Kraftfahrzeugen),8,im Handelsregister eingetragen,Lichtenberg,11400929,Weitlingkiez,Neu-Lichtenberg,Lichtenberg Mitte,Rummelsburg938935271784,Berlin,10407,52.533503653,13.433762615,464622,4646,46,0 Beschäftigte,GH m. Dentalbedarf,"GH m. pharmazeutischen, medizinischen u. orthopädischen Erze",Großhandel (ohne Handel mit Kraftfahrzeugen u. Krafträdern),8,im Handelsregister eingetragen,Pankow,03701660,Bötzowstraße,Prenzlauer Berg Süd,Südlicher Prenzlauer Berg,Prenzlauer Berg939925871086,Berlin,13595,52.505479801,13.188138406,70220,7022,70,0 Beschäftigte,Unternehmensberatung,Unternehmensberatung,Verwaltung u. Führung v. Unternehmen u. Betrieben; Unternehm,10,im Handelsregister eingetragen,Spandau,05200634,Börnicker Straße,Wilhelmstadt,Wilhelmstadt / Staaken,Wilhelmstadt934582271274,Berlin,10315,52.510980752,13.524213516,81210,8121,81,0 Beschäftigte,Allgemeine Gebäudereinigung,Allgemeine Gebäudereinigung,Gebäudebetreuung; Garten- u. Landschaftsbau,8,im Handelsregister eingetragen,Lichtenberg,11401033,Gensinger Straße,Friedrichsfelde Nord,Lichtenberg Mitte,Friedrichsfelde947140271134,Berlin,12557,52.442739396,13.567122735,68202,6820,68,0 Beschäftigte,"Vermietung, Verpachtung v. eigenen oder geleasten Gewerbegru","Vermietung, Verpachtung v. eigenen oder geleasten Grundstück",Grundstücks- u. Wohnungswesen,8,Kleingewerbetreibender,Treptow-Köpenick,09200819,Köllnische Vorstadt,Köllnische Vorstadt/Spindlersfeld,Treptow-Köpenick 2,Köpenick946137071790,Berlin,13127,52.600902542,13.429993023,731108,7311,73,0 Beschäftigte,"Promotion, Propagandisten",Werbeagenturen,Werbung u. Marktforschung,8,im Handelsregister eingetragen,Pankow,03200308,Nisbléstraße,Buchholz,Nördliches Pankow,Französisch Buchholz94522027734,Berlin,10243,52.515523718,13.440733468,14142,1414,14,0 Beschäftigte,H. v. gewirkter u. gestrickter Wäsche (ohne Miederwaren),H. v. Wäsche,H. v. Bekleidung,8,im Handelsregister eingetragen,Friedrichshain-Kreuzberg,02400624,Weberwiese,Karl-Marx-Allee Süd,Friedrichshain West,Friedrichshain947305871686,Berlin,10407,52.531540573,13.43117659,411010,4110,41,0 Beschäftigte,Baubetreuung,Erschließung v. Grundstücken; Bauträger,Hochbau,8,im Handelsregister eingetragen,Pankow,03701660,Bötzowstraße,Prenzlauer Berg Süd,Südlicher Prenzlauer Berg,Prenzlauer Berg946623671412,Berlin,13127,52.610060621,13.420035265,829992,8299,82,1 - 3 Beschäftigte,Vermittlung v. Aufträgen / Verträgen / Unternehmensdienstlei,Erbringung sonstiger wirtschaftlicher Dienstleistungen f. Un,Erbringung v. wirtschaftlichen Dienstleistungen f. Unternehm,8,im Handelsregister eingetragen,Pankow,03200310,Krugpfuhl,Buchholz,Nördliches Pankow,Französisch Buchholz94639027634,Berlin,12279,52.413347617,13.362821298,47111,4711,47,0 Beschäftigte,"EH m. Nahrungs- u. Genussmitteln, Getränken u. Tabakwaren, o","EH m. Waren verschiedener Art, Hauptrichtung Nahrungs- u. Ge",Einzelhandel (ohne Handel mit Kraftfahrzeugen),8,im Handelsregister eingetragen,Tempelhof-Schöneberg,07601236,Marienfelder Allee Nordwest,Marienfelde Nord,Marienfelde / Lichtenrade,Marienfelde944323271744,Berlin,10625,52.50783543,13.3158577,731108,7311,73,0 Beschäftigte,"Promotion, Propagandisten",Werbeagenturen,Werbung u. Marktforschung,8,im Handelsregister eingetragen,Charlottenburg-Wilmersdorf,04300624,Savignyplatz,Otto-Suhr-Allee/Kantstraße,Charlottenburg Zentrum,Charlottenburg9456174758,Berlin,10115,52.527534823,13.397711955,62019,6201,62,0 Beschäftigte,Sonstige Softwareentwicklung,Programmierungstätigkeiten,Erbringung v. Dienstleistungen der Informationstechnologie,8,im Handelsregister eingetragen,Mitte,01100309,Oranienburger Straße,Alexanderplatz,Zentrum,Mitte949201274,Berlin,10249,52.520972812,13.446590758,13300,1330,13,4 - 6 Beschäftigte,Veredlung v. Textilien u. Bekleidung,Veredlung v. Textilien u. Bekleidung,H. v. Textilien,8,Kleingewerbetreibender,Friedrichshain-Kreuzberg,02400522,Richard-Sorge-Viertel,Karl-Marx-Allee Nord,Friedrichshain West,Friedrichshain94987447248,Berlin,10787,52.50376099,13.344579012,56103,5610,56,0 Beschäftigte,Imbissstuben u.ä.,"Restaurants, Gaststätten, Imbissstuben, Cafés, Eissalons u.",Gastronomie,8,im Handelsregister eingetragen,Tempelhof-Schöneberg,07100101,Wittenbergplatz,Schöneberg Nordwest,Schöneberg Nord,Schöneberg949162871876,Berlin,13357,52.550845752,13.378002374,80100,8010,80,1 - 3 Beschäftigte,Private Wach- u. Sicherheitsdienste,Private Wach- u. Sicherheitsdienste,Wach- u. Sicherheitsdienste sowie Detekteien,8,Kleingewerbetreibender,Mitte,01401044,Uferstraße,Wedding Zentrum,Wedding,Gesundbrunnen94889347978,Berlin,10787,52.505371109,13.337132418,475402,4754,47,20 - 49 Beschäftigte,EH m. Elektronik u. elektronischen Erzeugnissen,EH m. elektrischen Haushaltsgeräten,Einzelhandel (ohne Handel mit Kraftfahrzeugen),9,Kleingewerbetreibender,Charlottenburg-Wilmersdorf,04501042,Breitscheidplatz,Lietzenburger Straße,Wilmersdorf Zentrum,Charlottenburg949003871346,Berlin,13158,52.591337966,13.371840664,900141,9001,90,0 Beschäftigte,Diskjockey / Moderation / mobile Disko / Alleinunterhalter /,Darstellende Kunst,"Kreative, künstlerische u. unterhaltende Tätigkeiten",8,im Handelsregister eingetragen,Pankow,03400618,Rosenthal,Schönholz/Wilhelmsruh/Rosenthal,Südliches Pankow,Rosenthal943547471158,Berlin,13086,52.551838646,13.451587802,960221,9602,96,0 Beschäftigte,Fingernagelstudio / Nageldesign,Frisör- u. Kosmetiksalons,Erbringung v. sonstigen überwiegend persönlichen Dienstleist,8,im Handelsregister eingetragen,Pankow,03500935,Behaimstraße,Weißensee,Südliches Weißensee,Weißensee947120471068,Berlin,12059,52.482611719,13.452489415,4520,4520,45,1 - 3 Beschäftigte,Instandhaltung u. Reparatur v. Kraftwagen,Instandhaltung u. Reparatur v. Kraftwagen,Handel mit Kraftfahrzeugen; Instandhaltung u. Reparatur v. K,8,Kleingewerbetreibender,Neukölln,08100419,Treptower Straße Nord,Rixdorf,Neukölln,Neukölln949548671162,Berlin,12689,52.56658636,13.558204799,731108,7311,73,0 Beschäftigte,"Promotion, Propagandisten",Werbeagenturen,Werbung u. Marktforschung,8,im Handelsregister eingetragen,Marzahn-Hellersdorf,10100101,Marzahn West,Marzahn Nord,Marzahn,Marzahn949684871616,Berlin,13187,52.566899828,13.402072131,532004,5320,53,0 Beschäftigte,Kurierdienste,"Sonstige Post-, Kurier- u. Expressdienste","Post-, Kurier- u. Expressdienste",8,im Handelsregister eingetragen,Pankow,03400721,Florakiez,Pankow Zentrum,Südliches Pankow,Pankow946042871476,Berlin,13187,52.569100731,13.404070855,92001,9200,92,0 Beschäftigte,Spielhallen u. Betrieb v. Spielautomaten,"Spiel-, Wett- u. Lotteriewesen","Spiel-, Wett- u. Lotteriewesen",8,im Handelsregister eingetragen,Pankow,03400723,Garbátyplatz,Pankow Zentrum,Südliches Pankow,Pankow949761671872,Berlin,10435,52.5400467,13.41692918,59201,5920,59,0 Beschäftigte,Tonstudios u. H. v. Hörfunkbeiträgen,Tonstudios; H. v. Hörfunkbeiträgen; Verlegen v. bespielten T,"Herstellung, Verleih u. Vertrieb v. Filmen u. Fernsehprogram",8,im Handelsregister eingetragen,Pankow,03701555,Sredzkistraße,Prenzlauer Berg Südwest,Südlicher Prenzlauer Berg,Prenzlauer Berg953269271564,Berlin,14167,52.431809351,13.279733187,479198,4791,47,1 - 3 Beschäftigte,Verkauf über Internet / e-commerce / Onlinehandel,Versand- u. Interneteinzelhandel,Einzelhandel (ohne Handel mit Kraftfahrzeugen),8,Kleingewerbetreibender,Steglitz-Zehlendorf,06300632,Schweizer Viertel,Drakestraße,Zehlendorf Süd/Lichterfelde West,Lichterfelde95069167972,Berlin,12347,52.441113052,13.420748409,56101,5610,56,0 Beschäftigte,Restaurants mit herkömmlicher Bedienung,"Restaurants, Gaststätten, Imbissstuben, Cafés, Eissalons u.",Gastronomie,8,Kleingewerbetreibender,Neukölln,08200725,Mohriner Allee Nord,Britz,Britz/Buckow,Britz953120471068,Berlin,10777,52.498857251,13.352004249,821100,8211,82,0 Beschäftigte,Büroservice,Allgemeine Sekretariats- u. Schreibdienste,Erbringung v. wirtschaftlichen Dienstleistungen f. Unternehm,8,im Handelsregister eingetragen,Tempelhof-Schöneberg,07100102,Kalckreuthstraße,Schöneberg Nordwest,Schöneberg Nord,Schöneberg950106071020,Berlin,10247,52.513271558,13.462639996,56101,5610,56,0 Beschäftigte,Restaurants mit herkömmlicher Bedienung,"Restaurants, Gaststätten, Imbissstuben, Cafés, Eissalons u.",Gastronomie,8,im Handelsregister eingetragen,Friedrichshain-Kreuzberg,02500831,Wismarplatz,Frankfurter Allee Süd FK,Friedrichshain Ost,Friedrichshain95181607720,Berlin,10405,52.536601509,13.418929796,56101,5610,56,1 - 3 Beschäftigte,Restaurants mit herkömmlicher Bedienung,"Restaurants, Gaststätten, Imbissstuben, Cafés, Eissalons u.",Gastronomie,12,Kleingewerbetreibender,Pankow,03701555,Sredzkistraße,Prenzlauer Berg Südwest,Südlicher Prenzlauer Berg,Prenzlauer Berg95541487716,Berlin,14193,52.488018454,13.298207699,56301,5630,56,0 Beschäftigte,Schankwirtschaften,Ausschank v. Getränken,Gastronomie,7,im Handelsregister eingetragen,Charlottenburg-Wilmersdorf,04400727,Flinsberger Platz,Grunewald,Wilmersdorf Süd,Schmargendorf95608807960,Berlin,10961,52.493997304,13.397018242,62019,6201,62,20 - 49 Beschäftigte,Sonstige Softwareentwicklung,Programmierungstätigkeiten,Erbringung v. Dienstleistungen der Informationstechnologie,8,Kleingewerbetreibender,Friedrichshain-Kreuzberg,02200210,Urbanstraße,Tempelhofer Vorstadt,Kreuzberg Süd,Kreuzberg95429647988,Berlin,13347,52.546391884,13.369005671,79110,7911,79,1 - 3 Beschäftigte,Reisebüros,Reisebüros,"Reisebüros, Reiseveranstalter u. Erbringung sonstiger Reserv",8,Kleingewerbetreibender,Mitte,01401043,Antonstraße,Wedding Zentrum,Wedding,Wedding956332871776,Berlin,13437,52.591322629,13.342098541,731108,7311,73,0 Beschäftigte,"Promotion, Propagandisten",Werbeagenturen,Werbung u. Marktforschung,8,im Handelsregister eingetragen,Reinickendorf,12500926,Wittenau Mitte,Nord 2 - Waidmannslust/Wittenau/Lübars,Wittenau/Borsigwalde,Wittenau957579071930,Berlin,13189,52.554271191,13.429246975,7022001,7022,70,0 Beschäftigte,Marketingberatung,Unternehmensberatung,Verwaltung u. Führung v. Unternehmen u. Betrieben; Unternehm,8,im Handelsregister eingetragen,Pankow,03400828,Spiekermann Straße,Pankow Süd,Südliches Pankow,Pankow958134071780,Berlin,14195,52.451248712,13.270246476,682010,6820,68,1 - 3 Beschäftigte,"Verwaltung v. eigenen Grundstücken, Gebäuden u. Wohnungen","Vermietung, Verpachtung v. eigenen oder geleasten Grundstück",Grundstücks- u. Wohnungswesen,7,Kleingewerbetreibender,Steglitz-Zehlendorf,06400842,Hüttenweg,Zehlendorf Nord,Zehlendorf Nord/Wannsee,Dahlem959106071020,Berlin,10243,52.508816477,13.450026294,56103,5610,56,1 - 3 Beschäftigte,Imbissstuben u.ä.,"Restaurants, Gaststätten, Imbissstuben, Cafés, Eissalons u.",Gastronomie,7,im Handelsregister eingetragen,Friedrichshain-Kreuzberg,02400624,Weberwiese,Karl-Marx-Allee Süd,Friedrichshain West,Friedrichshain95764147138,Berlin,14169,52.438086666,13.269478937,731108,7311,73,0 Beschäftigte,"Promotion, Propagandisten",Werbeagenturen,Werbung u. Marktforschung,8,im Handelsregister eingetragen,Steglitz-Zehlendorf,06400841,Zehlendorf Eiche,Zehlendorf Nord,Zehlendorf Nord/Wannsee,Zehlendorf95654827494,Berlin,10249,52.523180537,13.453207779,56101,5610,56,4 - 6 Beschäftigte,Restaurants mit herkömmlicher Bedienung,"Restaurants, Gaststätten, Imbissstuben, Cafés, Eissalons u.",Gastronomie,7,im Handelsregister eingetragen,Friedrichshain-Kreuzberg,02500726,Hausburgviertel,Frankfurter Allee Nord,Friedrichshain Ost,Friedrichshain95894227474,Berlin,12347,52.46144625,13.435425682,7490010,7490,74,1 - 3 Beschäftigte,Vermögensverwaltung,"Sonstige freiberufliche, wissenschaftliche u. technische Tät","Sonstige freiberufliche, wissenschaftliche u. technische Tät",7,Kleingewerbetreibender,NULL,,NULL,NULL,NULL,NULL953781071270,Berlin,14163,52.446690109,13.243208124,56101,5610,56,0 Beschäftigte,Restaurants mit herkömmlicher Bedienung,"Restaurants, Gaststätten, Imbissstuben, Cafés, Eissalons u.",Gastronomie,8,im Handelsregister eingetragen,Steglitz-Zehlendorf,06400838,Krumme Lanke,Zehlendorf Nord,Zehlendorf Nord/Wannsee,Zehlendorf